"Category","Project","Recipient","Description","Contact","URL","Year","Quarter","Spend"
"Community & education","<a href=""https://www.meetup.com/web3-on-chain-dev-meetup-group/"" target=""_blank"">BeerFi Prague Meetups</a>","","Technical meetups focused on builders and contract development, hosted in Prague, Czech Republic.","","https://blog.ethereum.org/2024/08/30/esp-allocation-q224","2024","Q2","8471704.14"
"Community & education","<a href=""https://aprende.cryptoversidad.com/"" target=""_blank"">Blockchain Course with UNAH</a>","<a href=""https://cryptoversidad.com/"" target=""_blank"">Cryptoversidad</a>","Comprehensive program on cryptocurrency and blockchain with a focus on the Ethereum ecosystem, delivered in collaboration with the Universidad Nacional Autónoma de Honduras (UNAH).","","https://blog.ethereum.org/2024/08/30/esp-allocation-q224","2024","Q2","8471704.14"
"Community & education","<a href=""https://www.codeafrica.xyz/"" target=""_blank"">Code Africa Hackathon</a>","","<a href=""https://ethereum.org/en/roadmap/account-abstraction/#account-abstraction"" target=""_blank"">account abstraction</a>","","https://blog.ethereum.org/2024/08/30/esp-allocation-q224","2024","Q2","8471704.14"
"Community & education","<a href=""https://blocksplit.net/democracy/"" target=""_blank"">Digital Democracy Day</a>","<a href=""https://blocksplit.net/"" target=""_blank"">BlockSplit</a>","Event organized in Split, Croatia that delved into the future of collaborative technology and plural democracy, with an emphasis on funding journalism and running digital elections.","","https://blog.ethereum.org/2024/08/30/esp-allocation-q224","2024","Q2","8471704.14"
"Community & education","<a href=""https://dwebcamp.org/fellowships/"" target=""_blank"">DWeb Fellowship Program</a>","","<a href=""https://dwebcamp.org/"" target=""_blank"">DWeb Camp</a>","","https://blog.ethereum.org/2024/08/30/esp-allocation-q224","2024","Q2","8471704.14"
"Community & education","","<a href=""https://esatya.io/"" target=""_blank"">eSatya</a>","Supporting blockchain awareness and community-building efforts in Nepal through the development of an Ethereum-focused curriculum, meetups, and blockchain sessions.","<a href=""mailto:hello@esatya.io"" target=""_blank"">Email</a>, <a href=""https://x.com/Esatya_io"" target=""_blank"">Twitter</a>","https://blog.ethereum.org/2024/08/30/esp-allocation-q224","2024","Q2","8471704.14"
"Community & education","<a href=""https://www.ethaccra.xyz/"" target=""_blank"">ETHAccra</a>","","Hackathon in Accra, Ghana that will be accompanied by workshops in several universities to generate interest in Ethereum.","","https://blog.ethereum.org/2024/08/30/esp-allocation-q224","2024","Q2","8471704.14"
"Community & education","<a href=""https://www.ethbeijing.xyz/"" target=""_blank"">ETH Beijing Hackathon</a>","","<a href=""https://ethereum.org/en/layer-2/"" target=""_blank"">layer 2</a>, <a href=""https://ethereum.org/en/dapps/"" target=""_blank"">dapps</a>","","https://blog.ethereum.org/2024/08/30/esp-allocation-q224","2024","Q2","8471704.14"
"Community & education","<a href=""https://ethbelgrade.rs/"" target=""_blank"">ETH Belgrade</a>","","Conference and hackathon hosted in Belgrade, Serbia revolving around topics such as core protocol and infrastructure, tooling, and security.","","https://blog.ethereum.org/2024/08/30/esp-allocation-q224","2024","Q2","8471704.14"
"Community & education","<a href=""https://ethdublin.io/"" target=""_blank"">ETHDublin</a>","","Hackathon and conference with tracks such as ReFi, cybersecurity and digital privacy, and public goods, organized in Dublin, Ireland","","https://blog.ethereum.org/2024/08/30/esp-allocation-q224","2024","Q2","8471704.14"
"Community & education","<a href=""https://ethecuador.org/"" target=""_blank"">ETH Ecuador</a>","","Conference co-hosted by prominent universities in Quito, Ecuador that delved into topics such as smart contracts, applications and the future of blockchain, and legal tech.","","https://blog.ethereum.org/2024/08/30/esp-allocation-q224","2024","Q2","8471704.14"
"Community & education","<a href=""https://ethereumargentina.org/"" target=""_blank"">Ethereum Argentina</a>","","<a href=""https://ethereum.org/en/layer-2/"" target=""_blank"">L2s</a>","","https://blog.ethereum.org/2024/08/30/esp-allocation-q224","2024","Q2","8471704.14"
"Community & education","<a href=""https://ethereumchile.org/"" target=""_blank"">Ethereum Chile: Cordillera Connect</a>","","<a href=""https://ethereum.org/en/staking"" target=""_blank"">staking</a>","","https://blog.ethereum.org/2024/08/30/esp-allocation-q224","2024","Q2","8471704.14"
"Community & education","<a href=""https://github.com/Kerala-Blockchain-Academy/ethereum-developer-program/wiki"" target=""_blank"">Ethereum Developer Program</a>","<a href=""https://kba.ai/"" target=""_blank"">Kerala Blockchain Academy</a>","Free and open-source online Ethereum developer course taking place over three months for students from the Indian Institute of Technology Kanpur.","","https://blog.ethereum.org/2024/08/30/esp-allocation-q224","2024","Q2","8471704.14"
"Community & education","<a href=""https://cometsweb3.space/ethereum-summer-school-cluj"" target=""_blank"">Ethereum Summer School</a>","<a href=""https://cometsweb3.space/"" target=""_blank"">Comets of Web3</a>","<a href=""https://ethereum.org/en/dapps/"" target=""_blank"">dapps</a>","","https://blog.ethereum.org/2024/08/30/esp-allocation-q224","2024","Q2","8471704.14"
"Community & education","<a href=""https://www.ethereumuruguay.org/"" target=""_blank"">Ethereum Uruguay</a>","","Buildathon and event with tracks such as infrastructure and security, public goods, and DeFi, hosted in Montevideo, Uruguay.","","https://blog.ethereum.org/2024/08/30/esp-allocation-q224","2024","Q2","8471704.14"
"Community & education","<a href=""https://ethkyiv.org/"" target=""_blank"">ETHKyiv</a>","","<a href=""https://ethereum.org/en/roadmap/"" target=""_blank"">Ethereum roadmap</a>, <a href=""https://ethereum.org/en/roadmap/account-abstraction/#account-abstraction"" target=""_blank"">account abstraction</a>","","https://blog.ethereum.org/2024/08/30/esp-allocation-q224","2024","Q2","8471704.14"
"Community & education","<a href=""https://ethprague.com/"" target=""_blank"">ETHPrague</a>","","Conference and hackathon in Prague, Czech Republic delving into topics such as Ethereum network operation, developer ecosystem and tooling, and cryptography.","","https://blog.ethereum.org/2024/08/30/esp-allocation-q224","2024","Q2","8471704.14"
"Community & education","<a href=""https://www.ethrome.org/"" target=""_blank"">ETHRome</a>","<a href=""https://linktr.ee/urbe.eth"" target=""_blank"">urbe.eth</a>","<a href=""https://ethereum.org/en/roadmap/account-abstraction/#account-abstraction"" target=""_blank"">account abstraction</a>","","https://blog.ethereum.org/2024/08/30/esp-allocation-q224","2024","Q2","8471704.14"
"Community & education","<a href=""https://www.ethshenzhen.org/"" target=""_blank"">ETHShenzhen</a>","","<a href=""https://ethereum.org/en/roadmap/verkle-trees/#verkle-trees"" target=""_blank"">Verkle Tries</a>, <a href=""https://ethereum.org/en/roadmap/danksharding/#danksharding"" target=""_blank"">danksharding</a>","","https://blog.ethereum.org/2024/08/30/esp-allocation-q224","2024","Q2","8471704.14"
"Community & education","<a href=""https://www.ethsofia.com/"" target=""_blank"">ETHSofia</a>","","<a href=""https://ethereum.org/en/layer-2/"" target=""_blank"">L2s</a>","","https://blog.ethereum.org/2024/08/30/esp-allocation-q224","2024","Q2","8471704.14"
"Community & education","","<a href=""https://www.ethsydney.net/"" target=""_blank"">ETHSydney</a>","Organizing a series of community activities in Sydney, Australia, including monthly meetups and a hackathon.","","https://blog.ethereum.org/2024/08/30/esp-allocation-q224","2024","Q2","8471704.14"
"Community & education","<a href=""https://www.ethtokyo.com/"" target=""_blank"">ETHTokyo</a>","<a href=""https://ethereumjapan.org/"" target=""_blank"">Ethereum Japan</a>","Hackathon with tracks on the freedom of transacting, robust democracy, and infrastructure and tooling hosted in Tokyo, Japan.","","https://blog.ethereum.org/2024/08/30/esp-allocation-q224","2024","Q2","8471704.14"
"Community & education","","<a href=""https://x.com/ethwarsaw"" target=""_blank"">ETHWarsaw</a>","Community-building and education activities including podcasts, workshops, meetups, and a hackathon for the Polish-speaking Ethereum community.","","https://blog.ethereum.org/2024/08/30/esp-allocation-q224","2024","Q2","8471704.14"
"Community & education","<a href=""https://www.hackofiesta.com/"" target=""_blank"">HackOFiesta 5.0</a>","","Hackathon organized in Lucknow, India with tracks focusing on Ethereum and blockchain, sustainability, and social good.","","https://blog.ethereum.org/2024/08/30/esp-allocation-q224","2024","Q2","8471704.14"
"Community & education","<a href=""https://x.com/IBF_Community/status/1779476274194604249"" target=""_blank"">IBF Blockchain Week</a>","<a href=""https://linktr.ee/ibf.bu"" target=""_blank"">Indian Blockchain Fraterntiy (IBF)</a>","6-day bootcamp in Bennett University, India to introduce students to Solidity programming through hands-on experiences.","","https://blog.ethereum.org/2024/08/30/esp-allocation-q224","2024","Q2","8471704.14"
"Community & education","<a href=""https://jadicc2024.dc.exa.unrc.edu.ar/"" target=""_blank"">Jornadas Argentinas de Didáctica de las Ciencias de la Computación</a>","","Virtual conference to exchange and discuss new ideas related to computer science pedagogy, including blockchain, for teachers of all educational levels, researchers, and policymakers.","","https://blog.ethereum.org/2024/08/30/esp-allocation-q224","2024","Q2","8471704.14"
"Community & education","","<a href=""https://kyivethereum.com/"" target=""_blank"">Kyiv Ethereum</a>","Series of meetups and workshops to educate the community about Ethereum and onboard more developers.","","https://blog.ethereum.org/2024/08/30/esp-allocation-q224","2024","Q2","8471704.14"
"Community & education","<a href=""https://the-mu.xyz/blog/muaccra-report"" target=""_blank"">muAccra</a>","","2-week developer gathering in Accra, Ghana.","","https://blog.ethereum.org/2024/08/30/esp-allocation-q224","2024","Q2","8471704.14"
"Community & education","<a href=""https://napul.eth.limo/"" target=""_blank"">NapulETH</a>","","<a href=""https://ethereum.org/en/defi/"" target=""_blank"">DeFi</a>","","https://blog.ethereum.org/2024/08/30/esp-allocation-q224","2024","Q2","8471704.14"
"Community & education","","<a href=""https://www.opensense.pw/"" target=""_blank"">OpenSense</a>","Grassroots blockchain security community focused on promoting collaboration, education, and covering the most interesting topics from the blockchain security ecosystem.","","https://blog.ethereum.org/2024/08/30/esp-allocation-q224","2024","Q2","8471704.14"
"Community & education","<a href=""https://lu.ma/eoxj4buo"" target=""_blank"">Privacy Reunion 2</a>, <a href=""https://lu.ma/privacyreunion3"" target=""_blank"">Privacy Reunion 3</a>","<a href=""https://pg.cryptobarna.info/"" target=""_blank"">Privacy Guardians</a>","Events delving into on-chain privacy and various cryptography techniques, hosted in Barcelona, Spain and La Chaux-de-Fonds, Switzerland.","","https://blog.ethereum.org/2024/08/30/esp-allocation-q224","2024","Q2","8471704.14"
"Community & education","<a href=""https://pldi24.sigplan.org/track/PLMW-PLDI-2024"" target=""_blank"">Programming Languages Mentoring Workshop (PLMW@PLDI 2024)</a>","","Workshop to broaden the exposure of late-stage undergraduate and early-stage graduate students to research and career opportunities in programming languages.","","https://blog.ethereum.org/2024/08/30/esp-allocation-q224","2024","Q2","8471704.14"
"Community & education","<a href=""https://github.com/kachris/Smart-contract-IoT"" target=""_blank"">Reference Design for Smart Contracts on IoT</a>","<a href=""https://www.linkedin.com/in/kachris?originalSubdomain=gr"" target=""_blank"">Christoforos Kachris</a>","Developing a framework to serve as reference design for IoT/embedded system developers who want to develop applications to interact with smart contracts and blockchain technology.","","https://blog.ethereum.org/2024/08/30/esp-allocation-q224","2024","Q2","8471704.14"
"Community & education","<a href=""https://esp.ethereum.foundation/devcon-grants"" target=""_blank"">Road to Devcon Grants Round</a>","","Grants round to support the growth of local Ethereum communities, initiatives, and projects in Southeast Asia.","","https://blog.ethereum.org/2024/08/30/esp-allocation-q224","2024","Q2","8471704.14"
"Community & education","<a href=""https://sigsing.vercel.app/"" target=""_blank"">Signature Singularity Residency</a>","","<a href=""https://ethereum.org/en/zero-knowledge-proofs/"" target=""_blank"">zero knowledge proofs</a>","","https://blog.ethereum.org/2024/08/30/esp-allocation-q224","2024","Q2","8471704.14"
"Community & education","<a href=""https://solidity-testing-guide.vercel.app/intro.html"" target=""_blank"">Solidity Testing Handbook</a>","<a href=""https://praneshasp.com/"" target=""_blank"">PraneshASP</a>","Completing a comprehensive, beginner-friendly handbook focused on Solidity testing and sharing it with the wider developer community.","","https://blog.ethereum.org/2024/08/30/esp-allocation-q224","2024","Q2","8471704.14"
"Community & education","<a href=""https://conference.tum-blockchain.com/"" target=""_blank"">TUM Blockchain Conference</a>","","Conference focusing on the five tracks of education, research, ecosystem, applications, and regulation, hosted in Munich, Germany.","","https://blog.ethereum.org/2024/08/30/esp-allocation-q224","2024","Q2","8471704.14"
"Community & education","<a href=""https://event.web3bridge.com/"" target=""_blank"">Web3 Lagos Conference</a>","<a href=""https://www.web3bridgeafrica.com/"" target=""_blank"">Web3Bridge</a>","Conference and hackathon run in Lagos, Nigeria delving into topics such as Ethereum core protocol development, open-source contribution, and building for the continent.","","https://blog.ethereum.org/2024/08/30/esp-allocation-q224","2024","Q2","8471704.14"
"Community & education","<a href=""https://red-rail-957300.hostingersite.com/"" target=""_blank"">Web3Privacy Summit #2</a>","","Privacy-focused conference in Prague, Czech Republic discussing ways to mainstream privacy in the web3 industry, protect developer rights, and build resilient protocols.","","https://blog.ethereum.org/2024/08/30/esp-allocation-q224","2024","Q2","8471704.14"
"Community & education","<a href=""https://0xcastle.xyz/"" target=""_blank"">0xCastle</a>","","Program exploring pivotal blockchain questions in privacy, scalability, and interoperability through a mix of talks, workshops, and research groups, hosted near Leipzig, Germany.","","https://blog.ethereum.org/2024/08/30/esp-allocation-q224","2024","Q2","8471704.14"
"Consensus layer","DAS Research","<a href=""https://codex.storage/"" target=""_blank"">Codex</a>","<a href=""https://ethereum.org/en/developers/docs/data-availability/#data-availability-sampling"" target=""_blank"">data availability sampling</a>","","https://blog.ethereum.org/2024/08/30/esp-allocation-q224","2024","Q2","8471704.14"
"Cryptography & zero knowledge proofs","<a href=""https://github.com/anon-aadhaar/anon-aadhaar"" target=""_blank"">Anon Aadhaar</a>","<a href=""https://github.com/hridambasu"" target=""_blank"">Hridam Basu</a>","<a href=""https://ethereum.org/en/zero-knowledge-proofs/"" target=""_blank"">ZKPs</a>","<a href=""https://t.me/hridambasu"" target=""_blank"">Telegram</a>, <a href=""mailto:hridam.basu@gmail.com"" target=""_blank"">Email</a>","https://blog.ethereum.org/2024/08/30/esp-allocation-q224","2024","Q2","8471704.14"
"Cryptography & zero knowledge proofs","Community Manager for PSE Asia Core Program","<a href=""https://github.com/eldenpark"" target=""_blank"">Elden Park</a>, <a href=""https://www.linkedin.com/in/zhyuc/"" target=""_blank"">Teresa</a>","<a href=""https://pse.dev/en/programs"" target=""_blank"">PSE Asia Core Program</a>","","https://blog.ethereum.org/2024/08/30/esp-allocation-q224","2024","Q2","8471704.14"
"Cryptography & zero knowledge proofs","Community Manager for PSE LatAm Core Program","<a href=""https://github.com/padimaster"" target=""_blank"">Alex Padilla</a>, <a href=""https://linktr.ee/lucilapastore"" target=""_blank"">Lucila Pastore</a>","<a href=""https://pse.dev/en/programs"" target=""_blank"">PSE LatAm Core Program</a>","","https://blog.ethereum.org/2024/08/30/esp-allocation-q224","2024","Q2","8471704.14"
"Cryptography & zero knowledge proofs","Cryptographic Research Group","<a href=""https://ic-people.epfl.ch/~achiesa/"" target=""_blank"">Alessandro Chiesa</a>","Supporting a Cryptographic Research Group for 1 year, led by EPFL Associate Professor Alessandro Chiesa.","","https://blog.ethereum.org/2024/08/30/esp-allocation-q224","2024","Q2","8471704.14"
"Cryptography & zero knowledge proofs","","<a href=""https://www.cursive.team/"" target=""_blank"">Cursive</a>","<a href=""https://sigsing.vercel.app/"" target=""_blank"">Signature Singularity Residency</a>","","https://blog.ethereum.org/2024/08/30/esp-allocation-q224","2024","Q2","8471704.14"
"Cryptography & zero knowledge proofs","Development for PSE Projects","<a href=""https://github.com/0xRowdy"" target=""_blank"">Mark Roddy</a>","<a href=""https://github.com/SemaphoreNetwork/semaphore_network_ethsim"" target=""_blank"">EthSIM</a>, <a href=""https://blog.ethereum.org/2024/06/24/next-billion-cohort4"" target=""_blank"">Next Billion Fellowship Cohort 4</a>, <a href=""https://pse.dev/"" target=""_blank"">PSE</a>","","https://blog.ethereum.org/2024/08/30/esp-allocation-q224","2024","Q2","8471704.14"
"Cryptography & zero knowledge proofs","<a href=""https://blog.seiya.work/2024/05/09/a-gentle-primer-on-ethereum.html"" target=""_blank"">Ethereum ZK Content in Japanese</a>","<a href=""https://www.facebook.com/seiya.kb"" target=""_blank"">Seiya Kobayashi</a>","<a href=""https://ethereum.org/en/zero-knowledge-proofs/"" target=""_blank"">ZKPs</a>","","https://blog.ethereum.org/2024/08/30/esp-allocation-q224","2024","Q2","8471704.14"
"Cryptography & zero knowledge proofs","Faster Scalar Multiplication of Elliptic Curves Using AVX-512","<a href=""https://github.com/herumi"" target=""_blank"">Mitsunari Shigeo</a>","Speeding up the scalar multiplication of multiple points on an elliptic curve using AVX-512.","<a href=""mailto:herumi@nifty.com"" target=""_blank"">Email</a>","https://blog.ethereum.org/2024/08/30/esp-allocation-q224","2024","Q2","8471704.14"
"Cryptography & zero knowledge proofs","FHE-Based Privacy-Preserving Mathematical Optimization","<a href=""https://github.com/0xvon"" target=""_blank"">0xvon</a>","Implementing an FHE-based algorithm that solves the minimum cost flow problem, a prime example of mathematical optimization, while keeping the data encrypted.","","https://blog.ethereum.org/2024/08/30/esp-allocation-q224","2024","Q2","8471704.14"
"Cryptography & zero knowledge proofs","From Zero to Halo2","<a href=""https://github.com/ryanycw"" target=""_blank"">ryanycw.eth</a>","<a href=""https://zcash.github.io/halo2/"" target=""_blank"">halo2</a>","","https://blog.ethereum.org/2024/08/30/esp-allocation-q224","2024","Q2","8471704.14"
"Cryptography & zero knowledge proofs","MACI Anonymized Poll Signup","<a href=""https://3327.io/"" target=""_blank"">3327</a>","<a href=""https://maci.pse.dev/"" target=""_blank"">MACI</a>, <a href=""https://maci.pse.dev/blog/upcoming-grants-2024"" target=""_blank"">blog post</a>","","https://blog.ethereum.org/2024/08/30/esp-allocation-q224","2024","Q2","8471704.14"
"Cryptography & zero knowledge proofs","<a href=""https://github.com/yashgo0018/maci-wrapper"" target=""_blank"">MACI Starter Kit</a>","<a href=""https://yashgoyal.dev/"" target=""_blank"">Yash Goyal</a>","<a href=""https://scaffoldeth.io/"" target=""_blank"">Scaffold-ETH 2</a>, <a href=""https://maci.pse.dev/"" target=""_blank"">MACI</a>","","https://blog.ethereum.org/2024/08/30/esp-allocation-q224","2024","Q2","8471704.14"
"Cryptography & zero knowledge proofs","<a href=""https://github.com/herumi/mcl"" target=""_blank"">mcl/bls Library</a>","<a href=""https://github.com/herumi"" target=""_blank"">Mitsunari Shigeo</a>","C++ pairing library with elliptic curve support for zkSNARK, Ethereum, and more which supports Ethereum 2.0's BLS signing API.","<a href=""mailto:herumi@nifty.com"" target=""_blank"">Email</a>","https://blog.ethereum.org/2024/08/30/esp-allocation-q224","2024","Q2","8471704.14"
"Cryptography & zero knowledge proofs","MPC Learning Grant","","<a href=""https://pse.dev/"" target=""_blank"">PSE</a>","","https://blog.ethereum.org/2024/08/30/esp-allocation-q224","2024","Q2","8471704.14"
"Cryptography & zero knowledge proofs","MPCStats","<a href=""https://github.com/exfinen"" target=""_blank"">Kazumune Masaki</a>","Assisting with the implementation and refinement of MPCStats by developing the web-based platform, building proof-of-concepts, and benchmarking different MPC protocols for the MPCStats library.","","https://blog.ethereum.org/2024/08/30/esp-allocation-q224","2024","Q2","8471704.14"
"Cryptography & zero knowledge proofs","<a href=""https://github.com/zksecurity/noname"" target=""_blank"">Noname</a>","<a href=""https://github.com/zksecurity"" target=""_blank"">zksecurity</a>","Domain-specific language (DSL) to write ZK circuits, inspired by Rust and Golang.","","https://blog.ethereum.org/2024/08/30/esp-allocation-q224","2024","Q2","8471704.14"
"Cryptography & zero knowledge proofs","PLUME & ZK Email Development","<a href=""https://github.com/shreyas-londhe"" target=""_blank"">Shreyas Londhe</a>","<a href=""https://github.com/plume-sig/zk-nullifier-sig"" target=""_blank"">PLUME</a>, <a href=""https://prove.email/"" target=""_blank"">ZK Email</a>","","https://blog.ethereum.org/2024/08/30/esp-allocation-q224","2024","Q2","8471704.14"
"Cryptography & zero knowledge proofs","Porting ZK-Kit Circuits","<a href=""https://github.com/RajeshRk18"" target=""_blank"">Rajesh Kanna</a>","<a href=""https://zkkit.pse.dev/"" target=""_blank"">ZK-Kit</a>","","https://blog.ethereum.org/2024/08/30/esp-allocation-q224","2024","Q2","8471704.14"
"Cryptography & zero knowledge proofs","Practical Async MPC","<a href=""https://x.com/AtsukiMomoseJP"" target=""_blank"">Atsuki Momose</a>","<a href=""https://ethereum.org/en/defi/"" target=""_blank"">DeFi</a>","","https://blog.ethereum.org/2024/08/30/esp-allocation-q224","2024","Q2","8471704.14"
"Cryptography & zero knowledge proofs","PSE Development Activities","<a href=""https://mach34.space/"" target=""_blank"">Mach34</a>","<a href=""https://pse.dev/"" target=""_blank"">PSE</a>","","https://blog.ethereum.org/2024/08/30/esp-allocation-q224","2024","Q2","8471704.14"
"Cryptography & zero knowledge proofs","","<a href=""https://github.com/The-QSig-Commission/"" target=""_blank"">The QSig Commission</a>","Investigating the viability and implementability of Quantum One Shot Signatures, with a particular focus on blockchain technology.","<a href=""https://x.com/fabgenovese"" target=""_blank"">Twitter</a>, <a href=""https://x.com/StefanoGogioso"" target=""_blank"">Twitter</a>","https://blog.ethereum.org/2024/08/30/esp-allocation-q224","2024","Q2","8471704.14"
"Cryptography & zero knowledge proofs","Reverie-2","Yulia Kotelnikova","Implementing non-native opening simulation argument and an atomic accumulation scheme based on it.","","https://blog.ethereum.org/2024/08/30/esp-allocation-q224","2024","Q2","8471704.14"
"Cryptography & zero knowledge proofs","<a href=""https://erroldrummond.gitbook.io/snark-fundamentals"" target=""_blank"">SNARK Fundamentals</a>","<a href=""https://x.com/EDGDrummond"" target=""_blank"">Errol Drummond</a>","Continued support to run the SNARK Fundamentals presentation for more communities, which aims to educate beginners on the core ideas of what ZK technology does.","","https://blog.ethereum.org/2024/08/30/esp-allocation-q224","2024","Q2","8471704.14"
"Cryptography & zero knowledge proofs","TLSNotary Server in a TEE","<a href=""https://github.com/maceip"" target=""_blank"">Ryan MacArthur</a>","<a href=""https://tlsnotary.org/"" target=""_blank"">TLSNotary</a>, <a href=""https://tlsnotary.org/"" target=""_blank"">TLSNotary</a>","","https://blog.ethereum.org/2024/08/30/esp-allocation-q224","2024","Q2","8471704.14"
"Cryptography & zero knowledge proofs","<a href=""https://github.com/social-tw/social-tw-website"" target=""_blank"">UniRep Social Taiwan</a>","","Completely anonymous social media platform that protects users' identities from being monitored, catered to the Taiwanese community.","","https://blog.ethereum.org/2024/08/30/esp-allocation-q224","2024","Q2","8471704.14"
"Cryptography & zero knowledge proofs","UX/UI Design Support","<a href=""https://www.linkedin.com/in/s%C3%A9bastien-dontigny/"" target=""_blank"">Sébastien Dontigny</a>","<a href=""https://github.com/SemaphoreNetwork/semaphore_network_ethsim"" target=""_blank"">EthSIM</a>, <a href=""https://pse.dev/"" target=""_blank"">PSE</a>","","https://blog.ethereum.org/2024/08/30/esp-allocation-q224","2024","Q2","8471704.14"
"Cryptography & zero knowledge proofs","<a href=""https://blog.ethereum.org/2024/06/25/zk-grants-round-announce"" target=""_blank"">ZK Grants Round</a>","","<a href=""https://ethereum.org/en/zero-knowledge-proofs/"" target=""_blank"">ZKPs</a>, <a href=""https://ethereum.org/en/layer-2/"" target=""_blank"">L2s</a>","","https://blog.ethereum.org/2024/08/30/esp-allocation-q224","2024","Q2","8471704.14"
