"Category","Project","Recipient","Description","Contact","URL","Year","Quarter","Spend"
"Developer experience & tooling","","<a href=""https://buidlguidl.com/"" target=""_blank"">BuidlGuidl</a>","Support for BuidlGuidl, a developer community and series of educational initiatives focused on onboarding developers to Ethereum.","NULL","https://blog.ethereum.org/2022/09/07/esp-q1-q2-allocation-update","2022","Q2","9374133.93"
"Developer experience & tooling","","<a href=""https://foundation.fsu.edu/"" target=""_blank"">Florida State University Foundation</a>","R&D on coverage and automated test case generation for Solidity smart contracts.","NULL","https://blog.ethereum.org/2022/09/07/esp-q1-q2-allocation-update","2022","Q2","9374133.93"
"Developer experience & tooling","Merge Client Combination Testing","<a href=""https://seamonkey.tech"" target=""_blank"">Sea Monkey</a>","Extensive testing of all execution and consensus layer client pairs leading up to The Merge.","NULL","https://blog.ethereum.org/2022/09/07/esp-q1-q2-allocation-update","2022","Q2","9374133.93"
"Developer experience & tooling","<a href=""https://github.com/decentralized-authority/node-launcher"" target=""_blank"">Node Launcher</a>","<a href=""https://decentralizedauthority.com/"" target=""_blank"">Decentralized Authority</a>","Open-source node deployment engine written in TypeScript that enables the easy creation of node deployment applications, with the goal of supporting all major execution and consensus layer clients.","NULL","https://blog.ethereum.org/2022/09/07/esp-q1-q2-allocation-update","2022","Q2","9374133.93"
"Developer experience & tooling","Python-Simulation Engine & Testing Suite","","<a href=""https://hardhat.org/"" target=""_blank"">Hardhat</a>, <a href=""https://www.paradigm.xyz/2021/12/introducing-the-foundry-ethereum-development-toolbox"" target=""_blank"">Foundry</a>","NULL","https://blog.ethereum.org/2022/09/07/esp-q1-q2-allocation-update","2022","Q2","9374133.93"
"Developer experience & tooling","SolidiKeY - Solidity Asset Flow Verification at Scale","<a href=""https://www.chalmers.se/en"" target=""_blank"">Chalmers University of Technology</a>","<a href=""https://www.key-project.org/"" target=""_blank"">KeY project verification system</a>","NULL","https://blog.ethereum.org/2022/09/07/esp-q1-q2-allocation-update","2022","Q2","9374133.93"
"Developer experience & tooling","<a href=""https://github.com/ChainSafe/web3.js"" target=""_blank"">Web3JS Library Maintenance</a>","<a href=""https://chainsafe.io/"" target=""_blank"">Chainsafe</a>","Collection of libraries that allows users to interact with a local or remote Ethereum node using HTTP, IPC, or WebSocket.","NULL","https://blog.ethereum.org/2022/09/07/esp-q1-q2-allocation-update","2022","Q2","9374133.93"
"Execution Layer","<a href=""https://github.com/ethereum/execution-specs"" target=""_blank"">Ethereum Execution Specifications</a>","<a href=""https://github.com/gurukamath"" target=""_blank"">Guruprasad Kamath</a>","Developing a Python implementation of Ethereum, that will serve as an executable specification for the execution layer. The specification is a Python implementation of Ethereum that prioritizes readability and simplicity.","NULL","https://blog.ethereum.org/2022/09/07/esp-q1-q2-allocation-update","2022","Q2","9374133.93"
"General Research","<a href=""/2022/07/29/academic-grants-grantee-announce"" target=""_blank"">Academic Grants Round</a>","","Proactive grants round funding formal research that aims to create more knowledge about Ethereum, blockchain technology, and related domains.","NULL","https://blog.ethereum.org/2022/09/07/esp-q1-q2-allocation-update","2022","Q2","9374133.93"
"General Research","The Grants (grants.xyz)","<a href=""https://www.ethereum.cn/"" target=""_blank"">Ethereum Community Network</a>","Research exploring different public goods funding mechanisms for the overall Ethereum open-source community in China.","NULL","https://blog.ethereum.org/2022/09/07/esp-q1-q2-allocation-update","2022","Q2","9374133.93"
"Layer 2","ETH.LIMO Infrastructure Support","<a href=""https://eth.limo/"" target=""_blank"">ETH.LIMO</a>","<a href=""https://ens.domains/"" target=""_blank"">ENS</a>, <a href=""https://ipfs.io/"" target=""_blank"">IPFS</a>","NULL","https://blog.ethereum.org/2022/09/07/esp-q1-q2-allocation-update","2022","Q2","9374133.93"
"Community & education","<a href=""https://blocksplit.net/"" target=""_blank"">Blocksplit</a>","","International conference focused on blockchain development and other use cases, held in Split, Croatia.","NULL","https://blog.ethereum.org/2022/09/07/esp-q1-q2-allocation-update","2022","Q1","9374133.93"
"Community & education","<a href=""https://daostar.org/"" target=""_blank"">DAOstar One</a>","","Metagovernance group developing, governing, and supporting interoperable standards for the DAO ecosystem.","NULL","https://blog.ethereum.org/2022/09/07/esp-q1-q2-allocation-update","2022","Q1","9374133.93"
"Community & education","<a href=""https://techeducators.co.uk/web3"" target=""_blank"">Developer Bootcamps</a>","<a href=""https://ethanglia.org/"" target=""_blank"">ETHAnglia</a>","<a href=""https://techeducators.co.uk/"" target=""_blank"">Tech Educators</a>","NULL","https://blog.ethereum.org/2022/09/07/esp-q1-q2-allocation-update","2022","Q1","9374133.93"
"Community & education","<a href=""https://www.meetup.com/es-ES/Ethereum-Bogota/?_cookie-check=UPNVpcosWohK3E41"" target=""_blank"">Ethereum Bogotá</a>","","Community meetups in Bogotá, Colombia with introductory talks and workshops.","NULL","https://blog.ethereum.org/2022/09/07/esp-q1-q2-allocation-update","2022","Q1","9374133.93"
"Community & education","<a href=""https://www.meetup.com/es/EthereumCaracas/"" target=""_blank"">Ethereum Caracas</a>","","Monthly community meetup with in-person and streamed content.","NULL","https://blog.ethereum.org/2022/09/07/esp-q1-q2-allocation-update","2022","Q1","9374133.93"
"Community & education","Ethereum Environmental Use Case Explorations","<a href=""https://twitter.com/BenWest"" target=""_blank"">Ben West</a>","Research exploring and documenting climate-related use cases for Ethereum","NULL","https://blog.ethereum.org/2022/09/07/esp-q1-q2-allocation-update","2022","Q1","9374133.93"
"Community & education","Ethereum for Africa","<a href=""https://twitter.com/FrankDeya"" target=""_blank"">Frank Deya</a>","Support for Ethereum ecosystem building efforts in Africa.","NULL","https://blog.ethereum.org/2022/09/07/esp-q1-q2-allocation-update","2022","Q1","9374133.93"
"Community & education","Ethereum for Developers Course","<a href=""http://alumnusb.org/"" target=""_blank"">Universidad Simón Bolívar</a>","Creation of a course on developing on Ethereum at Universidad Simón Bolívar in Venezuela.","NULL","https://blog.ethereum.org/2022/09/07/esp-q1-q2-allocation-update","2022","Q1","9374133.93"
"Community & education","<a href=""https://ethglobal.com/"" target=""_blank"">ETHGlobal</a>","","Support for ETHGlobal programming including hackathons and summits, among other developer onboarding and education initiatives.","NULL","https://blog.ethereum.org/2022/09/07/esp-q1-q2-allocation-update","2022","Q1","9374133.93"
"Community & education","<a href=""https://ethprague.com"" target=""_blank"">ETHPrague</a>","","<a href=""https://www.paralelnipolis.cz/en/"" target=""_blank"">Paralelni Polis</a>","NULL","https://blog.ethereum.org/2022/09/07/esp-q1-q2-allocation-update","2022","Q1","9374133.93"
"Community & education","ETHRio","<a href=""https://linktr.ee/H.E.R.DAO"" target=""_blank"">H.E.R. DAO</a>","Ethereum-based workshops aiming to onboard newcomers to web3.","NULL","https://blog.ethereum.org/2022/09/07/esp-q1-q2-allocation-update","2022","Q1","9374133.93"
"Community & education","<a href=""https://www.meetup.com/ethereum-lima/"" target=""_blank"">Ethereum Lima</a>","","One-day in-person event with talks on Ethereum basic concepts, applications, and roadmap among the community of university students and young software developers in Lima, Peru.","NULL","https://blog.ethereum.org/2022/09/07/esp-q1-q2-allocation-update","2022","Q1","9374133.93"
"Community & education","Ethereum.Rio","","Conference organized in Rio de Janeiro, Brazil, which highlighted local builders and organizers while bringing in other web3 opportunities and companies.","NULL","https://blog.ethereum.org/2022/09/07/esp-q1-q2-allocation-update","2022","Q1","9374133.93"
"Community & education","<a href=""https://www.youtube.com/c/FilosofiaCodigo/videos"" target=""_blank"">Filosofía Código</a>","","Video series about Optimistic and ZK Rollups for Filosofía Código, a learning community of Spanish speaking blockchain builders.","NULL","https://blog.ethereum.org/2022/09/07/esp-q1-q2-allocation-update","2022","Q1","9374133.93"
"Community & education","<a href=""https://github.com/BuidlHonduras/monorepo"" target=""_blank"">Honduras Community Quadratic Funding</a>","<a href=""https://buidlhonduras.com/"" target=""_blank"">BUIDL Honduras</a>","<a href=""https://clr.fund"" target=""_blank"">clr.fund</a>","NULL","https://blog.ethereum.org/2022/09/07/esp-q1-q2-allocation-update","2022","Q1","9374133.93"
"Community & education","<a href=""https://www.renderatl.com/"" target=""_blank"">Render Atlanta</a>","","Conference with topics and experiences related to software engineering and culture, inviting engineers to learn from one another and advance their careers.","NULL","https://blog.ethereum.org/2022/09/07/esp-q1-q2-allocation-update","2022","Q1","9374133.93"
"Community & education","<a href=""https://smt-workshop.cs.uiowa.edu/2022/index.shtml"" target=""_blank"">SMT 2022</a>","<a href=""https://smt-workshop.cs.uiowa.edu/index.shtml"" target=""_blank"">SMT Workshop</a>","Workshop that aims to bring together researchers working on Satisfiability Modulo Theories (SMT) and users of SMT techniques and tools.","NULL","https://blog.ethereum.org/2022/09/07/esp-q1-q2-allocation-update","2022","Q1","9374133.93"
"Community & education","<a href=""https://spaghett-eth.com/"" target=""_blank"">SpaghettETH</a>","","Three-day Ethereum conference and hackathon in Milano, Italy, with hacks focused on organizations, public goods, and micro-economies.","NULL","https://blog.ethereum.org/2022/09/07/esp-q1-q2-allocation-update","2022","Q1","9374133.93"
"Community & education","Spanish Translation Guide","<a href=""https://linktr.ee/jacobo_blandon"" target=""_blank"">Jacobo Blandon</a>","Open guide—published as a blog post—to translating Ethereum-related materials into Spanish and preparing them for publication.","NULL","https://blog.ethereum.org/2022/09/07/esp-q1-q2-allocation-update","2022","Q1","9374133.93"
"Community & education","<a href=""https://tokenengineeringcommunity.github.io/website/docs/academy-welcome/#token-engineering-360"" target=""_blank"">TE 360</a>","<a href=""https://tecommons.org/"" target=""_blank"">Token Engineering Commons</a>","Sessions discussing challenges and opportunities in token engineering and crypto-economic systems from many angles, based on writings of leaders in the space.","NULL","https://blog.ethereum.org/2022/09/07/esp-q1-q2-allocation-update","2022","Q1","9374133.93"
"Community & education","<a href=""https://www.zeitgeist.xyz/"" target=""_blank"">Zeitgeist</a>","","Community of builders working on crypto-native products and protocols.","NULL","https://blog.ethereum.org/2022/09/07/esp-q1-q2-allocation-update","2022","Q1","9374133.93"
"Consensus layer","<a href=""https://github.com/sigp/beacon-fuzz"" target=""_blank"">Beacon Fuzz</a>","<a href=""https://sigmaprime.io/"" target=""_blank"">Sigma Prime</a>","Development and maintenance of Beacon Fuzz, an Ethereum consensus-layer fuzzing framework, specifically targeting new Merge functionality.","NULL","https://blog.ethereum.org/2022/09/07/esp-q1-q2-allocation-update","2022","Q1","9374133.93"
"Consensus layer","BLS External Signer using a Hardware Security Module","","BLS External Signer using a Hardware Security Module (HSM). Aiming to complete full HSM staking prototype, get onto testnets, and get user/community feedback.","NULL","https://blog.ethereum.org/2022/09/07/esp-q1-q2-allocation-update","2022","Q1","9374133.93"
"Consensus Layer","Formal Verification of DV Protocol","<a href=""https://consensys.net/"" target=""_blank"">ConsenSys</a>","Formal specification and verification of the Distributed Validator (DV) protocol, which allows Ethereum validators to split their validator into multiple client instances for increased private key security and greater resilience against downtime and node operator attacks.","NULL","https://blog.ethereum.org/2022/09/07/esp-q1-q2-allocation-update","2022","Q1","9374133.93"
"Consensus layer","<a href=""https://github.com/status-im/nimbus-eth2"" target=""_blank"">Nimbus Consensus Client</a>","<a href=""https://status.im/"" target=""_blank"">Status</a>","Continued development of the Nimbus consensus client.","NULL","https://blog.ethereum.org/2022/09/07/esp-q1-q2-allocation-update","2022","Q1","9374133.93"
"Cryptography & zero knowledge proofs","<a href=""https://www.auti.sm/explore"" target=""_blank"">Auti.sm</a>","<a href=""https://www.kyokan.io/"" target=""_blank"">Kyokan</a>","<a href=""https://ens.domains/"" target=""_blank"">ENS</a>, <a href=""https://github.com/appliedzkp/rln"" target=""_blank"">RLN</a>, <a href=""https://interep.link/"" target=""_blank"">Interep</a>, <a href=""https://semaphore.appliedzkp.org/"" target=""_blank"">Semaphore</a>","NULL","https://blog.ethereum.org/2022/09/07/esp-q1-q2-allocation-update","2022","Q1","9374133.93"
"Cryptography & zero knowledge proofs","Interep with BrightID","<a href=""https://github.com/jdhyun09"" target=""_blank"">Donghyun Jeong</a>, <a href=""https://github.com/Insun35"" target=""_blank"">Insun Yu</a>, <a href=""https://github.com/dvlprsh"" target=""_blank"">Seohee Park</a>","<a href=""https://interep.link/"" target=""_blank"">Interep</a>, <a href=""https://www.brightid.org/"" target=""_blank"">BrightID</a>, <a href=""https://clr.fund/#/"" target=""_blank"">clr.fund</a>, <a href=""https://semaphore.appliedzkp.org/"" target=""_blank"">Semaphore</a>","NULL","https://blog.ethereum.org/2022/09/07/esp-q1-q2-allocation-update","2022","Q1","9374133.93"
"Cryptography & zero knowledge proofs","<a href=""https://github.com/appliedzkp/maci"" target=""_blank"">MACI</a>","","Improvements to MACI (Minimal Anti-Collusion Infrastructure) including security against more potential attacks, integrating a better Proof-of-Identity mechanism, and building a minimum quadratic funding infrastructure, as well as developing a trusted setup solution.","NULL","https://blog.ethereum.org/2022/09/07/esp-q1-q2-allocation-update","2022","Q1","9374133.93"
"Cryptography & zero knowledge proofs","MEV-resistant AMM","<a href=""https://github.com/formula-zero"" target=""_blank"">Formula Zero</a>","Automated market maker demonstrating time-lock encryption as a core component to address Maximal Extractable Value in DeFi protocols, using Verifiable Delay Functions and ZK proofs.","NULL","https://blog.ethereum.org/2022/09/07/esp-q1-q2-allocation-update","2022","Q1","9374133.93"
"Cryptography & zero knowledge proofs","","<a href=""https://www.upf.edu/en/"" target=""_blank"">Pompeu Fabra University</a>","Investigation into how to build an index hiding vector commitment that is memory efficient, aiming to provide a tool for SNARK applications needing one-time privacy preserving reveals.","NULL","https://blog.ethereum.org/2022/09/07/esp-q1-q2-allocation-update","2022","Q1","9374133.93"
"Cryptography & zero knowledge proofs","Quadrating Voting dApp","<a href=""https://github.com/chnejohnson?tab=repositories"" target=""_blank"">Johnson Chen</a>","Quadratic voting dApp on top of MACI 1.0 as a proportional resource allocation mechanism based on quadratic voting.","NULL","https://blog.ethereum.org/2022/09/07/esp-q1-q2-allocation-update","2022","Q1","9374133.93"
"Cryptography & zero nowledge proofs","<a href=""https://github.com/njofce/zk-chat"" target=""_blank"">RLN Anonymous Chat</a>","<a href=""https://www.linkedin.com/in/njofce"" target=""_blank"">Nasi Jofche</a>","<a href=""https://interep.link/"" target=""_blank"">Interep</a>","NULL","https://blog.ethereum.org/2022/09/07/esp-q1-q2-allocation-update","2022","Q1","9374133.93"
"Cryptography & zero knowledge proofs","<a href=""https://github.com/tlsnotary"" target=""_blank"">TLS Notary</a>","<a href=""https://github.com/themighty1"" target=""_blank"">Dan</a>, <a href=""https://github.com/sinui0"" target=""_blank"">sinui0</a>","Protocol using shared keys between two parties to send an encrypted authenticated request to a TLS webserver, allowing proof of provenance of web2 data without third-party access.","NULL","https://blog.ethereum.org/2022/09/07/esp-q1-q2-allocation-update","2022","Q1","9374133.93"
"Cryptography & zero knowledge proofs","<a href=""https://github.com/lazovicff/eigen-trust"" target=""_blank"">ZK EigenTrust</a>","<a href=""https://github.com/lazovicff"" target=""_blank"">Filip Lazovic</a>","<a href=""https://medium.com/oscar-tech/developing-the-eigentrust-algorithm-and-determining-trustworthiness-online-6c51b2c2938f"" target=""_blank"">EigenTrust</a>, <a href=""https://zcash.github.io/halo2/design/proving-system.html"" target=""_blank"">Halo2</a>, <a href=""https://github.com/libp2p"" target=""_blank"">libp2p</a>","NULL","https://blog.ethereum.org/2022/09/07/esp-q1-q2-allocation-update","2022","Q1","9374133.93"
"Developer experience & tooling","Automated Security Audits Research","<a href=""https://deepreason.xyz"" target=""_blank"">Walden Yan</a>","Investigation into zero-spec, automated security audits of smart contracts using formal verification.","NULL","https://blog.ethereum.org/2022/09/07/esp-q1-q2-allocation-update","2022","Q1","9374133.93"
"Developer experience & tooling","","<a href=""https://eth.limo/"" target=""_blank"">ETH.LIMO</a>","Cloud infrastructure migration and development of open-source custom middleware for Skynet storage proxying.","NULL","https://blog.ethereum.org/2022/09/07/esp-q1-q2-allocation-update","2022","Q1","9374133.93"
"Developer experience & tooling","<a href=""https://github.com/spruceid/siwe"" target=""_blank"">Sign-In with Ethereum: Phase 2</a>","<a href=""https://spruceid.com/"" target=""_blank"">Spruce Systems</a>","<a href=""https://ens.domains/"" target=""_blank"">ENS</a>","NULL","https://blog.ethereum.org/2022/09/07/esp-q1-q2-allocation-update","2022","Q1","9374133.93"
"Execution layer","<a href=""https://github.com/Omni-Analytics-Group/eth-difficulty-bomb-analysis"" target=""_blank"">Difficulty Bomb Estimation Analysis</a>","<a href=""https://github.com/Omni-Analytics-Group"" target=""_blank"">Omni Analytics</a>","<a href=""https://docs.ethhub.io/questions-about-ethereum/what-is-the-difficulty-bomb/"" target=""_blank"">difficulty bomb</a>","NULL","https://blog.ethereum.org/2022/09/07/esp-q1-q2-allocation-update","2022","Q1","9374133.93"
"Execution layer","Dynamical Analysis of EIP-1559","","<a href=""https://eips.ethereum.org/EIPS/eip-1559"" target=""_blank"">EIP-1559</a>","NULL","https://blog.ethereum.org/2022/09/07/esp-q1-q2-allocation-update","2022","Q1","9374133.93"
"Execution layer","<a href=""https://github.com/henridf/eip44s-proto"" target=""_blank"">EIP-4444 Prototyping</a>","<a href=""https://github.com/henridf"" target=""_blank"">Henri DF</a>","<a href=""https://eips.ethereum.org/EIPS/eip-4444"" target=""_blank"">EIP-4444</a>","NULL","https://blog.ethereum.org/2022/09/07/esp-q1-q2-allocation-update","2022","Q1","9374133.93"
"Execution layer","Erigon Client and Protocol R&D","<a href=""https://github.com/ledgerwatch/erigon"" target=""_blank"">Erigon</a>","Funding for Erigon's continued work on the Ethereum mainnet, including their client implementation and applied R&D on performance optimizations.","NULL","https://blog.ethereum.org/2022/09/07/esp-q1-q2-allocation-update","2022","Q1","9374133.93"
"Execution layer","<a href=""https://github.com/ethereum/execution-specs"" target=""_blank"">Ethereum Execution Layer Executable Specifications</a>","","Development of definitive specifications for what constitutes a valid block or execution payload, in the form of a Python library written expressly for the purpose of clarity.","NULL","https://blog.ethereum.org/2022/09/07/esp-q1-q2-allocation-update","2022","Q1","9374133.93"
"Execution layer","<a href=""https://github.com/status-im/nimbus-eth1"" target=""_blank"">Nimbus Execution Client</a>","<a href=""https://status.im/"" target=""_blank"">Status</a>","Continued development of the efficiency- and security-focused Nimbus execution client.","NULL","https://blog.ethereum.org/2022/09/07/esp-q1-q2-allocation-update","2022","Q1","9374133.93"
"Execution layer","Fluffy Client/Portal Network Development","<a href=""https://nimbus.team"" target=""_blank"">Nimbus</a>","<a href=""https://our.status.im/nimbus-fluffly/"" target=""_blank"">Fluffy ultralight client</a>, <a href=""https://github.com/ethereum/portal-network-specs"" target=""_blank"">Portal Network</a>","NULL","https://blog.ethereum.org/2022/09/07/esp-q1-q2-allocation-update","2022","Q1","9374133.93"
"General research","<a href=""https://daocollective.xyz/"" target=""_blank"">DAO Research Collective</a>","","Initiative to accelerate DAO functionality by procuring, open-sourcing, and organizing research foundational to effective DAO operation.","NULL","https://blog.ethereum.org/2022/09/07/esp-q1-q2-allocation-update","2022","Q1","9374133.93"
"Indirect funding","<a href=""https://github.com/eea-oasis/baseline"" target=""_blank"">Baseline Protocol</a>","<a href=""https://opencollective.com/"" target=""_blank"">Open Collective</a>","Funding for grants supporting research, development, and adoption of the Baseline protocol, which allows businesses to synchronize their systems of record and reduce costly errors in B2B transactions.","NULL","https://blog.ethereum.org/2022/09/07/esp-q1-q2-allocation-update","2022","Q1","9374133.93"
"Indirect funding","Technical Challenges in Enterprise Ethereum","","<a href=""https://www.baseline-protocol.org/"" target=""_blank"">Baseline protocol</a>","NULL","https://blog.ethereum.org/2022/09/07/esp-q1-q2-allocation-update","2022","Q1","9374133.93"
"Layer 2","<a href=""https://github.com/jzaki/bls-wallet"" target=""_blank"">BLS Wallet Improvements</a>","","Improvements to BLS Wallet, a Layer 2 smart contract wallet using BLS signatures and transaction aggregation.","NULL","https://blog.ethereum.org/2022/09/07/esp-q1-q2-allocation-update","2022","Q1","9374133.93"
"Layer 2","ETH.LIMO Infrastructure Support","<a href=""https://eth.limo/"" target=""_blank"">ETH.LIMO</a>","<a href=""https://ens.domains/"" target=""_blank"">ENS</a>, <a href=""https://ipfs.io/"" target=""_blank"">IPFS</a>","NULL","https://blog.ethereum.org/2022/09/07/esp-q1-q2-allocation-update","2022","Q1","9374133.93"
"User experience","<a href=""https://darkcrystal.pw/"" target=""_blank"">Dark Crystal for Ethereum</a>","<a href=""https://magmacollective.org/"" target=""_blank"">Magma Collective</a>","Development of an Ethereum-specific implementation of Dark Crystal, a social key recovery protocol using Shamir's Secret Sharing, building from the previous standalone implementation to one that integrates with existing wallets.","NULL","https://blog.ethereum.org/2022/09/07/esp-q1-q2-allocation-update","2022","Q1","9374133.93"
"Community & education","<a href=""https://www.web3lagos.org/"" target=""_blank"">Web3 Lagos</a>","","Conference in Lagos, Nigeria covering a variety of topics including making the switch from Web2 to Web3.","NULL","https://blog.ethereum.org/2022/02/15/esp-q3-q4-allocation-update","2021","Q4","2992000"
"Community & education","<a href=""https://esatya.io/fellowship/2021"" target=""_blank"">Blockchain Fellowship</a>","<a href=""https://esatya.io/"" target=""_blank"">ESatya</a>","Three month online course aiming to familiarize Nepalese developers with the key elements of blockchain technology through instruction and project-based learning.","NULL","https://blog.ethereum.org/2022/02/15/esp-q3-q4-allocation-update","2021","Q4","2992000"
"Community & education","<a href=""https://www.meetup.com/es/ethejecafetero/events/"" target=""_blank"">Ethereum Eje Cafetero Meetups</a>","<a href=""https://linktr.ee/ethejecafetero"" target=""_blank"">Ethereum Eje Cafetero</a>","Community talks and meetups in Colombia's Coffee Region.","NULL","https://blog.ethereum.org/2022/02/15/esp-q3-q4-allocation-update","2021","Q4","2992000"
"Community & education","<a href=""https://t.me/joinchat/bDsyPVIMcAo2ZjEx"" target=""_blank"">ETH CUBA</a>","","Kickstarting community growth in Cuba.","NULL","https://blog.ethereum.org/2022/02/15/esp-q3-q4-allocation-update","2021","Q4","2992000"
"Community & education","Ethereum Medellín","<a href=""https://platohedro.org/"" target=""_blank"">Platohedro</a>","Community development in Medellín, Colombia.","NULL","https://blog.ethereum.org/2022/02/15/esp-q3-q4-allocation-update","2021","Q4","2992000"
"Community & education","<a href=""https://www.meetup.com/ethereum-tegucigalpa/"" target=""_blank"">Ethereum Tegucigalpa</a>","","Support for Ethereum community development in Honduras including meetups, developer events and Spanish-language Ethereum content.","NULL","https://blog.ethereum.org/2022/02/15/esp-q3-q4-allocation-update","2021","Q4","2992000"
"Community & education","<a href=""https://0xparc.org/"" target=""_blank"">0xPARC</a>","","Organization supporting applied cryptography research and development.","NULL","https://blog.ethereum.org/2022/02/15/esp-q3-q4-allocation-update","2021","Q4","2992000"
