"Category","Project","Recipient","Description","Contact","URL","Year","Quarter","Spend"
"Cryptography & zero knowledge proofs","Semaphore User Research","<a href=""https://www.linkedin.com/in/lauranmunoz/?locale=en_US"" target=""_blank"">Laura Navarro Muñoz (LauNaMu)</a>","<a href=""https://semaphore.appliedzkp.org/"" target=""_blank"">Semaphore</a>","","https://blog.ethereum.org/2023/06/15/allocation-update-q1-23","2023","Q1","12910616.53"
"Cryptography & zero knowledge proofs","<a href=""https://github.com/rbkhmrcr/curve-maps"" target=""_blank"">Toolkit of Hashes to Elliptic Curves</a>","","Rust implementation of the most performant not-currently implemented hash to elliptic curve functions that satisfy the indifferentiability property.","","https://blog.ethereum.org/2023/06/15/allocation-update-q1-23","2023","Q1","12910616.53"
"Cryptography & zero knowledge proofs","<a href=""https://wamu.tech/"" target=""_blank"">Wamu</a>","<a href=""https://davidsemakula.com/"" target=""_blank"">David Semakula</a>","Protocol and library for building threshold signature wallets controlled by multiple decentralized identities that implements an augmented CGGMP21 threshold signature scheme in Rust.","<a href=""https://davidsemakula.com/"" target=""_blank"">Website</a>","https://blog.ethereum.org/2023/06/15/allocation-update-q1-23","2023","Q1","12910616.53"
"Cryptography & zero knowledge proofs","ZK Circuits for ZK Eigen Trust","<a href=""https://twitter.com/honeybee199309"" target=""_blank"">Guorong Du</a>","<a href=""https://github.com/eigen-trust/eigen-trust"" target=""_blank"">ZK Eigen Trust</a>, <a href=""https://community.optimism.io/docs/governance/attestation-station/"" target=""_blank"">AttestationStation</a>, <a href=""https://zcash.github.io/halo2/design/proving-system.html"" target=""_blank"">halo2 proving system</a>","","https://blog.ethereum.org/2023/06/15/allocation-update-q1-23","2023","Q1","12910616.53"
"Cryptography & zero knowledge proofs","<a href=""http://zkshield.io/"" target=""_blank"">zkShield</a>","<a href=""https://github.com/bankisan"" target=""_blank"">Spiro</a>","<a href=""https://ethereum.org/en/zero-knowledge-proofs/"" target=""_blank"">ZKPs</a>, <a href=""https://ethereum.org/en/roadmap/account-abstraction/"" target=""_blank"">account abstraction</a>","","https://blog.ethereum.org/2023/06/15/allocation-update-q1-23","2023","Q1","12910616.53"
"Data analysis","WAX Analytics Dashboard","<a href=""https://github.com/outsider-analytics"" target=""_blank"">Outsider Analytics</a>","<a href=""https://getwax.org/"" target=""_blank"">WAX</a>","","https://blog.ethereum.org/2023/06/15/allocation-update-q1-23","2023","Q1","12910616.53"
"Data analysis","<a href=""https://app.metrika.co/ethereum/dashboard/withdrawals-overview?tr=1d"" target=""_blank"">Withdrawals Dashboard</a>","<a href=""https://twitter.com/metrikaco?lang=en"" target=""_blank"">Metrika</a>","Withdrawals monitoring dashboard to help the Ethereum community prepare for the Shanghai fork and track the impact withdrawals are having on network dynamics.","","https://blog.ethereum.org/2023/06/15/allocation-update-q1-23","2023","Q1","12910616.53"
"Developer experience & tooling","","<a href=""https://buidlguidl.com/"" target=""_blank"">Buidl Guidl</a>","Developer community and series of educational initiatives focused on onboarding developers to Ethereum.","","https://blog.ethereum.org/2023/06/15/allocation-update-q1-23","2023","Q1","12910616.53"
"Developer experience & tooling","","<a href=""https://ethstaker.cc/"" target=""_blank"">ETHStaker</a>","Continued support for ETHStaker, a community group promoting and supporting Ethereum staking through education, advocacy, technical support, tooling, etc.","","https://blog.ethereum.org/2023/06/15/allocation-update-q1-23","2023","Q1","12910616.53"
"Developer experience & tooling","eth-docker Security Audit","<a href=""https://sigmaprime.io/"" target=""_blank"">Sigma Prime</a>","<a href=""https://eth-docker.net/"" target=""_blank"">eth-docker</a>","","https://blog.ethereum.org/2023/06/15/allocation-update-q1-23","2023","Q1","12910616.53"
"Developer experience & tooling","<a href=""https://github.com/imapp-pl/gas-cost-estimator"" target=""_blank"">EVM Gas Cost Estimator</a>","<a href=""https://imapp.pl/"" target=""_blank"">Imapp</a>","Extension of the EVM Gas Cost Estimator project, applying the method of estimating real-life computation costs of EVM opcodes to more EVM projects and execution layer clients.","","https://blog.ethereum.org/2023/06/15/allocation-update-q1-23","2023","Q1","12910616.53"
"Developer experience & tooling","<a href=""https://github.com/ponkila/homestaking-infra"" target=""_blank"">Home-staking Infrastructure Powered by Nix</a>","<a href=""https://github.com/tupakkatapa"" target=""_blank"">Jesse Karjalainen</a>, <a href=""https://juuso.dev/"" target=""_blank"">Juuso Haavisto</a>","Open-source tooling for the production of Linux distribution images which have validator software pre-installed with Nix, to simplify home-staking.","","https://blog.ethereum.org/2023/06/15/allocation-update-q1-23","2023","Q1","12910616.53"
"Developer experience & tooling","Interoperable Tools for Creating and Analyzing did:ethr DIDs","<a href=""https://danubetech.com/"" target=""_blank"">Danube Tech</a>","<a href=""https://github.com/decentralized-identity/universal-registrar"" target=""_blank"">Universal Registrar</a>, <a href=""https://ethereum.org/en/decentralized-identity/"" target=""_blank"">decentralized identifiers (DIDs)</a>","<a href=""mailto:contact@danubetech.com"" target=""_blank"">Email</a>, <a href=""https://twitter.com/DanubeTechNews"" target=""_blank"">Twitter</a>","https://blog.ethereum.org/2023/06/15/allocation-update-q1-23","2023","Q1","12910616.53"
"Developer experience & tooling","<a href=""https://github.com/eth-infinitism/trampoline"" target=""_blank"">Trampoline</a>","","Continued development of Trampoline, an ERC-4337-enabled browser extension template wallet.","","https://blog.ethereum.org/2023/06/15/allocation-update-q1-23","2023","Q1","12910616.53"
"Developer experience & tooling","<a href=""https://github.com/wallet-test-framework/"" target=""_blank"">Wallet Test Framework</a>","","Shared automated infrastructure for wallet testing with a simulated chain, JavaScript/TypeScript tests, and the ability to run in-browser that covers the execution-apis specification.","<a href=""https://discord.com/invite/Zshy8C3s?utm_source=Discord%20Widget&utm_medium=Connect"" target=""_blank"">Discord</a>","https://blog.ethereum.org/2023/06/15/allocation-update-q1-23","2023","Q1","12910616.53"
"Developer experience & tooling","<a href=""https://github.com/web3/web3.js"" target=""_blank"">Web3.js Library Maintenance</a>","<a href=""https://chainsafe.io/"" target=""_blank"">ChainSafe</a>","Collection of libraries that allows users to interact with a local or remote Ethereum node using HTTP, IPC, or WebSocket.","","https://blog.ethereum.org/2023/06/15/allocation-update-q1-23","2023","Q1","12910616.53"
"Execution layer","<a href=""https://github.com/ledgerwatch/erigon"" target=""_blank"">Erigon Execution Client</a>","","Funding for Erigon's continued work on the Ethereum mainnet, specifically their client implementation, applied R&D on performance optimizations, and broader engagement with the client and research community.","","https://blog.ethereum.org/2023/06/15/allocation-update-q1-23","2023","Q1","12910616.53"
"General research","<a href=""https://yarrow.id/"" target=""_blank"">A Differentiable Circuit Intermediate Representation for ZK Machine Learning</a>","<a href=""https://github.com/statusfailed/"" target=""_blank"">Paul Wilson</a>","<a href=""https://ethereum.org/en/zero-knowledge-proofs/"" target=""_blank"">ZKPs</a>","<a href=""https://discord.gg/GWhkmQgMn7"" target=""_blank"">Discord</a>, <a href=""https://github.com/yarrow-id/"" target=""_blank"">GitHub</a>, <a href=""https://twitter.com/yarrow_id"" target=""_blank"">Twitter</a>, <a href=""https://yarrow.id"" target=""_blank"">Website</a>","https://blog.ethereum.org/2023/06/15/allocation-update-q1-23","2023","Q1","12910616.53"
"General research","<a href=""https://esp.ethereum.foundation/academic-grants"" target=""_blank"">Academic Grants Round</a>","","Grants round funding formal research that aims to create more knowledge about Ethereum, blockchain technology, and related domains.","","https://blog.ethereum.org/2023/06/15/allocation-update-q1-23","2023","Q1","12910616.53"
"Indirect funding","<a href=""https://eth.movimentotransformers.org/"" target=""_blank"">ETHPorto Quadratic Funding Round</a>","","<a href=""https://m-trf.org/"" target=""_blank"">Movimento Transformers</a>","","https://blog.ethereum.org/2023/06/15/allocation-update-q1-23","2023","Q1","12910616.53"
"Layer 2","<a href=""https://github.com/State-Channel-4"" target=""_blank"">Channel 4</a>","<a href=""https://github.com/hackertron/"" target=""_blank"">Jayaditya Gupta</a>","Primitive protocol that will use state channel technique to enable off-chain transactions to solve online incentive issues, with possible future implementation for lightning payment in developing countries, mesh networks, and more.","","https://blog.ethereum.org/2023/06/15/allocation-update-q1-23","2023","Q1","12910616.53"
"Layer 2","<a href=""https://blog.ethereum.org/2023/02/14/layer-2-grants-roundup"" target=""_blank"">Layer 2 Grants Round</a>","","<a href=""https://ethereum.org/en/layer-2/"" target=""_blank"">L2</a>","","https://blog.ethereum.org/2023/06/15/allocation-update-q1-23","2023","Q1","12910616.53"
"Layer 2","","<a href=""https://l2beat.com/scaling/tvl"" target=""_blank"">L2BEAT</a>","<a href=""https://ethereum.org/en/layer-2/"" target=""_blank"">L2</a>","","https://blog.ethereum.org/2023/06/15/allocation-update-q1-23","2023","Q1","12910616.53"
"Other","","<a href=""https://nodeset.io/"" target=""_blank"">NodeSet</a>","Organization that seeks to promote small and medium-sized professional node operators, while working on enabling node operators to run validators on behalf of people.","<a href=""https://discord.gg/eUUTUKSJ"" target=""_blank"">Discord</a>, <a href=""https://twitter.com/NodeOperators"" target=""_blank"">Twitter</a>","https://blog.ethereum.org/2023/06/15/allocation-update-q1-23","2023","Q1","12910616.53"
"Other","<a href=""https://revoke.cash/"" target=""_blank"">Revoke.cash</a>","<a href=""https://github.com/rkalis"" target=""_blank"">Rosco Kalis</a>","Free and open-source tool for revoking or updating token allowances, practicing proper wallet hygiene, and reducing the chances of users becoming the victim of allowance exploits.","","https://blog.ethereum.org/2023/06/15/allocation-update-q1-23","2023","Q1","12910616.53"
"Other","Transaction Simulation Security Research","<a href=""https://www.linkedin.com/in/roi-vazan/"" target=""_blank"">Roi Vazan</a>, <a href=""https://twitter.com/TalBeerySec"" target=""_blank"">Tal Be'ery</a>","Research analyzing possible attack vectors against transaction simulations and test leading web3 simulation providers against them.","<a href=""https://discord.gg/zengo"" target=""_blank"">Discord</a>, <a href=""mailto:X@ZenGo.com"" target=""_blank"">Email</a>, <a href=""https://twitter.com/ZenGo"" target=""_blank"">Twitter</a>","https://blog.ethereum.org/2023/06/15/allocation-update-q1-23","2023","Q1","12910616.53"
"Protocol growth & support","","<a href=""https://github.com/eth-infinitism/account-abstraction"" target=""_blank"">Account Abstraction Developer Team</a>","Support for the account abstraction developer team's work on ERC-4337 and its implementation, infrastructure, developer tools, documentation, educational content, ecosystem support, and additional account abstraction research.","","https://blog.ethereum.org/2023/06/15/allocation-update-q1-23","2023","Q1","12910616.53"
"Protocol growth & support","<a href=""https://eips.ethereum.org/EIPS/eip-6110"" target=""_blank"">EIP-6110: Supply Validator Deposits on Chain</a>","<a href=""https://github.com/kevinbogner"" target=""_blank"">Kevin Bogner</a>","Work on EIP-6110, which enables an in-protocol mechanism for deposit processing on the consensus layer and eliminates the proposer voting mechanism currently utilized.","","https://blog.ethereum.org/2023/06/15/allocation-update-q1-23","2023","Q1","12910616.53"
"Protocol growth & support","Implementing libp2p in C#","<a href=""https://nethermind.io/"" target=""_blank"">Nethermind</a>","<a href=""https://github.com/libp2p/specs"" target=""_blank"">libp2p</a>","","https://blog.ethereum.org/2023/06/15/allocation-update-q1-23","2023","Q1","12910616.53"
"Protocol growth & support","<a href=""https://blog.ethereum.org/2022/12/15/kzg-ceremony-grants-round"" target=""_blank"">KZG Ceremony Grants Round</a>","","<a href=""https://github.com/ethereum/kzg-ceremony"" target=""_blank"">Ethereum KZG Ceremony</a>","","https://blog.ethereum.org/2023/06/15/allocation-update-q1-23","2023","Q1","12910616.53"
"Protocol growth & support","Security Audit Explorations","<a href=""https://theredguild.org/"" target=""_blank"">The Red Guild</a>","Applied security research within the Ethereum ecosystem, with a focus on vulnerability research on smart-contract-based applications on application layer.","","https://blog.ethereum.org/2023/06/15/allocation-update-q1-23","2023","Q1","12910616.53"
"Community & education","Blockchain Education in Nepal","<a href=""https://esatya.io/"" target=""_blank"">eSatya</a>","Support to host free meetups and their blockchain course that aims to familiarize Nepalese developers with the key elements of blockchain through project-based learning.","NULL","https://blog.ethereum.org/2023/02/22/allocation-update-q4-22","2022","Q4","4370418.16"
"Community & education","","<a href=""https://cryptostats.community/"" target=""_blank"">CryptoStats</a>","Community-driven project that provides neutral crypto metrics and develops tools for gathering data and building websites that visualize the data in practical ways for the community.","NULL","https://blog.ethereum.org/2023/02/22/allocation-update-q4-22","2022","Q4","4370418.16"
"Community & education","<a href=""https://www.defilatam.com/"" target=""_blank"">DeFi LATAM</a>","","Meetup with educational talks and workshops to celebrate the end of the year and foster enthusiasm to continue building together in the next year.","NULL","https://blog.ethereum.org/2023/02/22/allocation-update-q4-22","2022","Q4","4370418.16"
"Community & education","<a href=""https://forum.devcon.org/t/launching-devcon-satellites/1364"" target=""_blank"">Devcon Satellite Events Grants</a>","","Sponsorship of Devcon-related meetups and watch parties around the globe, with the purpose of decentralizing Devcon VI and boosting local Ethereum communities.","NULL","https://blog.ethereum.org/2023/02/22/allocation-update-q4-22","2022","Q4","4370418.16"
"Community & education","Devcon VI Quadratic Funding Side Event","<a href=""https://ethcolombia.co/"" target=""_blank"">Ethereum Colombia</a>","Side event during Devcon VI to bring together the builders and organizers of the Latin American projects that participated in the quadratic funding round.","NULL","https://blog.ethereum.org/2023/02/22/allocation-update-q4-22","2022","Q4","4370418.16"
"Community & education","<a href=""https://pages.atato.com/ethbkk-2022-0"" target=""_blank"">ETHBKK 2022</a>","","Online conference in Bangkok, Thailand that aims to highlight Southeast Asian projects in the Ethereum ecosystem.","NULL","https://blog.ethereum.org/2023/02/22/allocation-update-q4-22","2022","Q4","4370418.16"
"Community & education","","<a href=""https://linktr.ee/ethereumhn"" target=""_blank"">Ethereum Honduras</a>","Supporting Ethereum Honduras in their community-building efforts, which include hosting meetups, creating educational content, and organizing grants programs.","NULL","https://blog.ethereum.org/2023/02/22/allocation-update-q4-22","2022","Q4","4370418.16"
"Community & education","<a href=""https://www.meetup.com/ethereum-hungary/"" target=""_blank"">Ethereum Hungary Meetups</a>","","Meetups to bring the Hungarian Ethereum community together, with talks and discussions on Ethereum's development.","NULL","https://blog.ethereum.org/2023/02/22/allocation-update-q4-22","2022","Q4","4370418.16"
"Community & education","<a href=""https://www.eventbrite.com/e/road-to-devcon-2022-tickets-428160739297"" target=""_blank"">Ethereum Miami Meetup</a>","","Meetup to learn more about Colombia's tech ecosystem and Devcon VI through panel discussions.","NULL","https://blog.ethereum.org/2023/02/22/allocation-update-q4-22","2022","Q4","4370418.16"
"Community & education","<a href=""https://link.ethsd.org/"" target=""_blank"">Ethereum San Diego</a>","","<a href=""https://docs.scaffoldeth.io/scaffold-eth/"" target=""_blank"">Scaffold-eth</a>","NULL","https://blog.ethereum.org/2023/02/22/allocation-update-q4-22","2022","Q4","4370418.16"
"Community & education","<a href=""https://github.com/jtriley-eth/the-ethereum-virtual-machine"" target=""_blank"">Ethereum Virtual Machine Book</a>","<a href=""https://github.com/jtriley-eth"" target=""_blank"">Joshua Trujillo</a>","<a href=""https://ethereum.org/en/developers/docs/evm/"" target=""_blank"">EVM</a>","NULL","https://blog.ethereum.org/2023/02/22/allocation-update-q4-22","2022","Q4","4370418.16"
"Community & education","<a href=""https://linktr.ee/ethereumuy"" target=""_blank"">Ethereum Uruguay</a>","","<a href=""http://www.puntameetup.com/"" target=""_blank"">Punta Tech</a>","NULL","https://blog.ethereum.org/2023/02/22/allocation-update-q4-22","2022","Q4","4370418.16"
"Community & education","<a href=""https://ethlatam.org/"" target=""_blank"">ETHLatam</a>","","<a href=""https://en.labitconf.com/"" target=""_blank"">LABITCONF</a>","NULL","https://blog.ethereum.org/2023/02/22/allocation-update-q4-22","2022","Q4","4370418.16"
"Community & education","<a href=""https://linktr.ee/eth.vietnam"" target=""_blank"">ETHVietnam</a>","","<a href=""https://www.eth-vietnam.com/"" target=""_blank"">three-day event and hackathon</a>","NULL","https://blog.ethereum.org/2023/02/22/allocation-update-q4-22","2022","Q4","4370418.16"
"Community & education","<a href=""https://dotlabs.notion.site/dotlabs/Hack-labs-CTF-41b5df524c8b4cd69227e236c265495d"" target=""_blank"">Hack.labs() CTF</a>","","<a href=""https://www.ethmedellin.co/"" target=""_blank"">ETH Medellín</a>","NULL","https://blog.ethereum.org/2023/02/22/allocation-update-q4-22","2022","Q4","4370418.16"
"Community & education","<a href=""https://twitter.com/kyiv_ethereum"" target=""_blank"">Kyiv Ethereum</a>","","<a href=""https://ethereum.org/en/developers/docs/evm/"" target=""_blank"">EVM</a>","NULL","https://blog.ethereum.org/2023/02/22/allocation-update-q4-22","2022","Q4","4370418.16"
"Community & education","<a href=""/2022/12/05/merge-data-challenge-results"" target=""_blank"">Merge Data Challenge</a>","","Challenge that rewarded data analysts who could document the best Merge data insights into the most readable blog post possible.","NULL","https://blog.ethereum.org/2023/02/22/allocation-update-q4-22","2022","Q4","4370418.16"
"Community & education","<a href=""https://twitter.com/peoplesdao"" target=""_blank"">Peoples' Cooperative</a>","","<a href=""https://ethereum.org/en/layer-2/"" target=""_blank"">layer 2</a>","NULL","https://blog.ethereum.org/2023/02/22/allocation-update-q4-22","2022","Q4","4370418.16"
"Community & education","<a href=""https://workingup.com.ec/sin-fronteras-tech/"" target=""_blank"">Sin Fronteras Tech</a>","<a href=""https://workingup.com.ec/"" target=""_blank"">WorkingUp</a>","Hackathon focused on developing solutions to the problems that Ecuador's migrant population experiences.","NULL","https://blog.ethereum.org/2023/02/22/allocation-update-q4-22","2022","Q4","4370418.16"
"Community & education","Smart Contracts Online Course and Lectures","<a href=""https://distributedlab.com/"" target=""_blank"">Distributed Lab</a>","<a href=""https://prometheus.org.ua/"" target=""_blank"">Prometheus</a>","NULL","https://blog.ethereum.org/2023/02/22/allocation-update-q4-22","2022","Q4","4370418.16"
"Community & education","<a href=""https://todaiweb3.com/hackathon/"" target=""_blank"">Student Blockchain Hackathon</a>","<a href=""https://mobile.twitter.com/todaiweb3"" target=""_blank"">Hongo Web3 Valley</a>","Hackathon for students in Japan focusing on the intersection between blockchain and social issues, with workshops and talks to guide beginners.","NULL","https://blog.ethereum.org/2023/02/22/allocation-update-q4-22","2022","Q4","4370418.16"
"Community & education","<a href=""https://www.ie.edu/entrepreneurship/news-and-events/events/tech4democracy-bogota/"" target=""_blank"">Tech4Democracy Bogotá</a>","<a href=""https://www.ie.edu/"" target=""_blank"">IE University</a>","Showcasing Latin American projects that are developing blockchain and web3 technologies that have the potential to further democratic values.","NULL","https://blog.ethereum.org/2023/02/22/allocation-update-q4-22","2022","Q4","4370418.16"
"Community & education","Web3 Onboarding Event","<a href=""https://beacons.ai/criptocuriosas"" target=""_blank"">Cripto Curiosas</a>","Talks and workshops in Peru aimed at onboarding women to web3.","NULL","https://blog.ethereum.org/2023/02/22/allocation-update-q4-22","2022","Q4","4370418.16"
"Community & education","<a href=""https://zkhack.dev/zkhackIII/"" target=""_blank"">ZK Hack III</a>","","Four-week virtual event featuring weekly workshops on key ZK concepts and tools, and advanced puzzle solving competitions to find bugs in protocols.","NULL","https://blog.ethereum.org/2023/02/22/allocation-update-q4-22","2022","Q4","4370418.16"
"Community & education","<a href=""https://zkproof.org/events/workshop5/"" target=""_blank"">5th ZKProof Workshop</a>","","Workshop held in Tel Aviv, Israel, to promote the standardization of ZK proof cryptography and increase the engagement of companies and researchers worldwide.","NULL","https://blog.ethereum.org/2023/02/22/allocation-update-q4-22","2022","Q4","4370418.16"
"Community & education","<a href=""https://cyber.biu.ac.il/event/the-13th-biu-winter-school-on-cryptography/"" target=""_blank"">13th Bar Ilan University Winter School on Cryptography</a>","","Program comprising lectures and tutorials that explore recent advances in blockchain technology, including consensus protocols, smart contracts, and bridges. Hosted in Tel Aviv, Israel.","NULL","https://blog.ethereum.org/2023/02/22/allocation-update-q4-22","2022","Q4","4370418.16"
"Consensus layer","<a href=""https://github.com/ethereum/requests-for-proposals/blob/master/open-rfps/das.md"" target=""_blank"">Data Availability Sampling Networking RFP</a>","<a href=""https://codex.storage/"" target=""_blank"">Codex</a>","Researching, modeling, and simulating a double-layer Kademlia protocol for Data Availability Sampling (DAS).","NULL","https://blog.ethereum.org/2023/02/22/allocation-update-q4-22","2022","Q4","4370418.16"
"Consensus layer","<a href=""https://github.com/metacraft-labs/DendrETH"" target=""_blank"">DendrETH</a>","<a href=""https://github.com/metacraft-labs"" target=""_blank"">Metacraft Labs</a>","Project developing ZK circuits for verifying claims regarding the current state of Ethereum, backed by the signatures of the entire Ethereum validator set. These ZK circuits will then be utilized in light client smart contracts.","NULL","https://blog.ethereum.org/2023/02/22/allocation-update-q4-22","2022","Q4","4370418.16"
"Consensus layer","<a href=""https://ethereumpools.info/"" target=""_blank"">Ethereum Pools</a>","","Dashboard that aggregates and monitors Ethereum validators belonging to well-known entities, such as staking pools and exchanges. Further develop an open-source Golang tool to allow monitoring validators at scale.","NULL","https://blog.ethereum.org/2023/02/22/allocation-update-q4-22","2022","Q4","4370418.16"
"Consensus layer","<a href=""https://lighthouse.sigmaprime.io/"" target=""_blank"">Lighthouse</a>","<a href=""https://sigmaprime.io/"" target=""_blank"">Sigma Prime</a>","Continued development of the Lighthouse consensus client.","NULL","https://blog.ethereum.org/2023/02/22/allocation-update-q4-22","2022","Q4","4370418.16"
"Consensus layer","","<a href=""https://www.openzeppelin.com/"" target=""_blank"">Open Zeppelin</a>","Open Zeppelin to audit the security of Ethereum's codebase.","NULL","https://blog.ethereum.org/2023/02/22/allocation-update-q4-22","2022","Q4","4370418.16"
"Consensus layer","Secure-Signer","Puffer","<a href=""https://boost.flashbots.net/"" target=""_blank"">MEV-Boost</a>","NULL","https://blog.ethereum.org/2023/02/22/allocation-update-q4-22","2022","Q4","4370418.16"
"Cryptography & zero knowledge proofs","Benchmarking Modern ZK Proof Systems with AI Primitives","<a href=""https://www.moduluslabs.xyz/"" target=""_blank"">Modulus Labs</a>","<a href=""https://ethereum.org/en/zero-knowledge-proofs/"" target=""_blank"">ZK proofs</a>","NULL","https://blog.ethereum.org/2023/02/22/allocation-update-q4-22","2022","Q4","4370418.16"
"Cryptography & zero knowledge proofs","BLISH Cryptography Course","","Series of free, cryptography-related lectures and workshops for students in Ukraine with strong mathematical skills.","NULL","https://blog.ethereum.org/2023/02/22/allocation-update-q4-22","2022","Q4","4370418.16"
"Cryptography & zero knowledge proofs","","<a href=""https://blockwallet.io/"" target=""_blank"">BlockWallet</a>","Building a robust product-market fit roadmap for BlockWallet—a privacy-focused, non-custodial browser extension wallet that enables users to store funds and interact with blockchain applications privately.","NULL","https://blog.ethereum.org/2023/02/22/allocation-update-q4-22","2022","Q4","4370418.16"
