"Category","Project","Recipient","Description","Contact","URL","Year","Quarter","Spend"
"Developer experience & tooling","Fe Repository Contributions","<a href=""https://github.com/saifalkatout"" target=""_blank"">Saif Katout</a>","<a href=""https://github.com/ethereum/fe"" target=""_blank"">Fe repository</a>","","https://blog.ethereum.org/2024/02/20/esp-allocation-q423","2023","Q4","30015316.13"
"Developer experience & tooling","<a href=""https://github.com/iron-wallet/iron"" target=""_blank"">Iron Wallet</a>","","Developer-centric wallet that has the usual functionality of a crypto wallet, as well as additional built-in tooling to speed up builders' development workflows.","","https://blog.ethereum.org/2024/02/20/esp-allocation-q423","2023","Q4","30015316.13"
"Developer experience & tooling","<a href=""https://github.com/protofire/solhint"" target=""_blank"">Solhint</a>","<a href=""https://protofire.io/"" target=""_blank"">Protofire DAO</a>","Continued development of Solhint, an open-source Solidity linter.","","https://blog.ethereum.org/2024/02/20/esp-allocation-q423","2023","Q4","30015316.13"
"Execution layer","","Account Abstraction Developer Team","<a href=""https://www.erc4337.io/"" target=""_blank"">ERC-4337</a>","","https://blog.ethereum.org/2024/02/20/esp-allocation-q423","2023","Q4","30015316.13"
"Execution layer","<a href=""https://nethermind.io/"" target=""_blank"">Nethermind</a>","","Support for Nethermind's internship program, with a focus on core protocol contributors.","","https://blog.ethereum.org/2024/02/20/esp-allocation-q423","2023","Q4","30015316.13"
"Execution layer","<a href=""https://efdn.notion.site/ROP-7-Economic-models-of-signature-aggregation-in-account-abstraction-ec5390efab864ed49a8535e8bdfff182"" target=""_blank"">ROP-7: Economic Models of Signature Aggregation in Account Abstraction</a>","<a href=""https://warpcast.com/seiryu"" target=""_blank"">Davide Rezzoli</a>","Investigating the design of a mechanism to align the Aggregator and User incentives in AA, in which the Aggregator should perform as much aggregation as possible and the User should pay the lowest fee necessary to compensate the Aggregator for its service.","","https://blog.ethereum.org/2024/02/20/esp-allocation-q423","2023","Q4","30015316.13"
"Execution layer","Verkle Tries Implementation Support","<a href=""https://www.onlydust.xyz/"" target=""_blank"">OnlyDust</a>","<a href=""https://www.hyperledger.org/projects/besu"" target=""_blank"">Hyperledger Besu</a>","","https://blog.ethereum.org/2024/02/20/esp-allocation-q423","2023","Q4","30015316.13"
"General growth & support","<a href=""https://github.com/bicos-io01/Revenue-Sharing-Source"" target=""_blank"">African Digital Repatriation Project</a>","<a href=""https://twitter.com/Mulengakapwepwe"" target=""_blank"">Mulenga Kapwepwe</a>","<a href=""https://blog.ethereum.org/2023/08/07/nb-fellows-cohort-3"" target=""_blank"">Next Billion Fellowship Cohort #3</a>","","https://blog.ethereum.org/2024/02/20/esp-allocation-q423","2023","Q4","30015316.13"
"General growth & support","<a href=""https://esp.ethereum.foundation/data-collection-grants"" target=""_blank"">Data Collection Grants Round</a>","","Grants round to encourage research and development around data collection and visualization of the Ethereum network.","","https://blog.ethereum.org/2024/02/20/esp-allocation-q423","2023","Q4","30015316.13"
"General growth & support","<a href=""https://esp.ethereum.foundation/devcon-grants"" target=""_blank"">Road to Devcon Grants Round</a>","","Grants round to support the growth of local Ethereum communities, initiatives, and projects in Southeast Asia.","","https://blog.ethereum.org/2024/02/20/esp-allocation-q423","2023","Q4","30015316.13"
"General growth & support","Technical Challenges in Enterprise Ethereum","","<a href=""https://www.baseline-protocol.org/"" target=""_blank"">Baseline protocol</a>","","https://blog.ethereum.org/2024/02/20/esp-allocation-q423","2023","Q4","30015316.13"
"General growth & support","<a href=""https://cryptofund.unicef.io/"" target=""_blank"">UNICEF CryptoFund</a>","","Financial vehicle allowing UNICEF to receive, hold, and disburse cryptocurrency to increase their operational efficiency, cost effectiveness, and transparency.","","https://blog.ethereum.org/2024/02/20/esp-allocation-q423","2023","Q4","30015316.13"
"Other","","<a href=""https://www.initc3.org/"" target=""_blank"">IC3</a>","Academic blockchain research initiative based at Cornell Tech with researchers across multiple universities with the goal of bringing the science of blockchains to the forefront and delivering blockchain innovation in code.","","https://blog.ethereum.org/2024/02/20/esp-allocation-q423","2023","Q4","30015316.13"
"Other","<a href=""https://securityalliance.org/"" target=""_blank"">Security Alliance (SEAL)</a>","","Common good infrastructure for coordination between security professionals, protocols, and the community to collaborate on and launch ambitious and impactful security initiatives.","","https://blog.ethereum.org/2024/02/20/esp-allocation-q423","2023","Q4","30015316.13"
"Community & education","<a href=""https://lu.ma/AAvolution"" target=""_blank"">AAvolution: Account Abstraction Village</a>","","Account abstraction event held in Paris, covering topics such as the history of account abstraction, key catalysts to mass adoption, and the future of account abstraction wallets.","","https://blog.ethereum.org/2023/12/19/esp-allocation-q323","2023","Q3","8945982.74"
"Community & education","<a href=""https://www.bundlebear.com/overview/all"" target=""_blank"">BundleBear</a>","<a href=""https://twitter.com/0xKofi"" target=""_blank"">0xKofi</a>","Database and dashboard providing transparent and verifiable insights into ERC-4337 users, operators, and activity.","","https://blog.ethereum.org/2023/12/19/esp-allocation-q323","2023","Q3","8945982.74"
"Community & education","Campus Developer Workshops","<a href=""https://twitter.com/ETHAccra"" target=""_blank"">ETHAccra</a>","Developer workshops taught in universities across Ghana, covering blockchain and Ethereum basics, smart contract development, and web3 front-end and back-end development.","","https://blog.ethereum.org/2023/12/19/esp-allocation-q323","2023","Q3","8945982.74"
"Community & education","<a href=""https://lu.ma/izmirdevconnect"" target=""_blank"">Devconnect İzmir Side Event</a>","<a href=""https://blockchaindeu.com/"" target=""_blank"">Blockchain DEU</a>","Meetup held in İzmir, Türkiye to introduce attendees to Ethereum and the importance of layer 2 (L2) solutions.","","https://blog.ethereum.org/2023/12/19/esp-allocation-q323","2023","Q3","8945982.74"
"Community & education","<a href=""https://lu.ma/d3fcpyu3"" target=""_blank"">Developer Onboarding Experience in Farsi Meetup</a>","<a href=""https://twitter.com/crypt0zan"" target=""_blank"">Women in Blockchain Farsi</a>","Meetup in Istanbul, Türkiye to connect with Farsi-speaking communities and educate attendees on the ways to access and navigate the web3 ecosystem.","","https://blog.ethereum.org/2023/12/19/esp-allocation-q323","2023","Q3","8945982.74"
"Community & education","Developer Workshops in Latin America","<a href=""https://www.colledge.social/"" target=""_blank"">Colledge</a>","Developer workshops for students organized at two universities in Latin America covering smart contract security, advanced Solidity, and L2.","","https://blog.ethereum.org/2023/12/19/esp-allocation-q323","2023","Q3","8945982.74"
"Community & education","","<a href=""https://devfolio.co/"" target=""_blank"">Devfolio</a>","Support to organize a series of programs including hackathons, fellowships, grants, and more that target developers, community builders, and students in India.","","https://blog.ethereum.org/2023/12/19/esp-allocation-q323","2023","Q3","8945982.74"
"Community & education","<a href=""https://www.cukurovablock.com/devconnecteathadana"" target=""_blank"">EaTH Adana</a>","<a href=""https://www.cukurovablock.com/"" target=""_blank"">Çukurova Blockchain</a>","Meetup organized in Adana, Türkiye to introduce attendees to the Ethereum ecosystem, the importance of Devconnect Istanbul, and web3 adoption.","","https://blog.ethereum.org/2023/12/19/esp-allocation-q323","2023","Q3","8945982.74"
"Community & education","<a href=""https://www.ethaccra.xyz/"" target=""_blank"">ETHAccra Hackathon</a>","","Hackathon in Accra, Ghana with a focus on social impact and sustainability, DeFi, and dapps.","","https://blog.ethereum.org/2023/12/19/esp-allocation-q323","2023","Q3","8945982.74"
"Community & education","","<a href=""https://ethbelgrade.rs/community"" target=""_blank"">ETH Belgrade</a>","Support to organize monthly meetups and workshops in Belgrade, Serbia to engage with the local Ethereum community.","<a href=""mailto:hello@ethbelgrade.rs"" target=""_blank"">Email</a>","https://blog.ethereum.org/2023/12/19/esp-allocation-q323","2023","Q3","8945982.74"
"Community & education","<a href=""https://www.ethchicago.xyz/"" target=""_blank"">ETHChicago Hackathon</a>","","Hackathon in Chicago, the United States with the goal of solving real-world use cases through decentralized technology.","","https://blog.ethereum.org/2023/12/19/esp-allocation-q323","2023","Q3","8945982.74"
"Community & education","<a href=""https://2023.ethcon.kr/"" target=""_blank"">EthCon Korea</a>","","Conference and hackathon in Seoul, South Korea to spotlight local projects, empower local community members, and bridge the gap between South Korea and the global Ethereum community.","","https://blog.ethereum.org/2023/12/19/esp-allocation-q323","2023","Q3","8945982.74"
"Community & education","<a href=""https://ethbolivia.com/"" target=""_blank"">Ethereum Bolivia Hackathon</a>","","Hackathon in La Paz, Bolivia that encourages builders to solve local problems using blockchain and educates them on a range of topics including smart contract integration, Ethereum infrastructure, and dapp development.","","https://blog.ethereum.org/2023/12/19/esp-allocation-q323","2023","Q3","8945982.74"
"Community & education","<a href=""https://www.meetup.com/ethereum-hungary/"" target=""_blank"">Ethereum Hungary Meetups</a>","","Monthly meetups organized in Budapest, Hungary revolving around technical topics such as Ethereum core protocol developments, zero knowledge machine learning (ZKML), and data availability sampling (DAS).","","https://blog.ethereum.org/2023/12/19/esp-allocation-q323","2023","Q3","8945982.74"
"Community & education","<a href=""https://ethmexico.org/"" target=""_blank"">Ethereum México</a>","","Conference in Mexico City, Mexico with a focus on topics such as zero knowledge (ZK), account abstraction, and public goods.","","https://blog.ethereum.org/2023/12/19/esp-allocation-q323","2023","Q3","8945982.74"
"Community & education","","<a href=""https://www.meetup.com/ethereum-slovenia/"" target=""_blank"">Ethereum Slovenia</a>","Support to organize monthly meetups, workshops, and a hackathon in Ljubljana, Slovenia.","","https://blog.ethereum.org/2023/12/19/esp-allocation-q323","2023","Q3","8945982.74"
"Community & education","<a href=""https://blog.ethereum.org/2023/09/20/ethereum-org-translatathon"" target=""_blank"">ethereum.org Translatathon</a>","","Translation competition to raise awareness about the importance of localizing content, incenticize translations in less active languages, onboard new contributors, and give back to their community of contributors.","","https://blog.ethereum.org/2023/12/19/esp-allocation-q323","2023","Q3","8945982.74"
"Community & education","<a href=""https://www.ethhangzhou.xyz/"" target=""_blank"">ETH Hangzhou Hackathon</a>","","Hackathon with a focus on public goods, L2 applications, and ZK organized in Hangzhou to promote the development of the Ethereum ecosystem in China.","","https://blog.ethereum.org/2023/12/19/esp-allocation-q323","2023","Q3","8945982.74"
"Community & education","<a href=""https://ethmunich.de/"" target=""_blank"">ETHMunich Hackathon</a>","","Hackathon in Munich, Germany with the goal of bringing together experienced blockchain hackers with talented students to solve real-world problems with the help of blockchain technology.","","https://blog.ethereum.org/2023/12/19/esp-allocation-q323","2023","Q3","8945982.74"
"Community & education","<a href=""https://ethsafari.xyz/"" target=""_blank"">ETHSafari</a>","","Conference, hackathon, and bootcamp organized in Kenya covering topics such as L2s, privacy, and account abstraction.","","https://blog.ethereum.org/2023/12/19/esp-allocation-q323","2023","Q3","8945982.74"
"Community & education","Fellowship","<a href=""https://www.kernel.community/en/"" target=""_blank"">KERNEL</a>","Provide KERNEL Fellows with opportunities to learn and build relationships, while having a support structure to focus on Ethereum public goods.","","https://blog.ethereum.org/2023/12/19/esp-allocation-q323","2023","Q3","8945982.74"
"Community & education","<a href=""https://geers.in/blockchain"" target=""_blank"">GEERS: Blockchain Edition</a>","","Technical workshops covering topics such as Solidity, security, and the Ethereum Virtual Machine (EVM) in Buenos Aires, Argentina.","","https://blog.ethereum.org/2023/12/19/esp-allocation-q323","2023","Q3","8945982.74"
"Community & education","","<a href=""https://hanniabu.com/"" target=""_blank"">hanniabu</a>","Develop community resources and tools that provide an overview of the health of the Ethereum network.","","https://blog.ethereum.org/2023/12/19/esp-allocation-q323","2023","Q3","8945982.74"
"Community & education","<a href=""https://www.instagram.com/inteli_blockchain"" target=""_blank"">Inteli Blockchain</a>","","Student-run hackathon in São Paulo, Brazil that aims to onboard students to blockchain and Ethereum.","","https://blog.ethereum.org/2023/12/19/esp-allocation-q323","2023","Q3","8945982.74"
"Community & education","<a href=""https://www.espe.edu.ec/latincrypt/"" target=""_blank"">Latincrypt</a>","","Conference in Sangolquí, Ecuador that brings together researchers and practitioners to present their latest findings in cryptology and information security.","","https://blog.ethereum.org/2023/12/19/esp-allocation-q323","2023","Q3","8945982.74"
"Community & education","<a href=""https://lu.ma/notdevcon"" target=""_blank"">notDEVCON</a>","<a href=""https://www.itublockchain.com/"" target=""_blank"">ITU Blockchain</a>","Summit in Istanbul, Türkiye focusing on the Ethereum ecosystem's core philosophy, covering topics such as public goods, decentralization, and censorship resistance.","","https://blog.ethereum.org/2023/12/19/esp-allocation-q323","2023","Q3","8945982.74"
"Community & education","<a href=""https://lu.ma/bg69ij5n"" target=""_blank"">Ready! Set! Devconnect!</a>","<a href=""https://linktr.ee/odtubc"" target=""_blank"">ODTÜ Blockchain</a>","Meetup held in Ankara, Türkiye providing attendees with an introduction to Ethereum and its various use-cases.","","https://blog.ethereum.org/2023/12/19/esp-allocation-q323","2023","Q3","8945982.74"
"Community & education","<a href=""https://www.secureum.xyz/trustx/"" target=""_blank"">Secureum TrustX</a>","","Community event dedicated to the Ethereum security ecosystem organized in Istanbul, Türkiye.","","https://blog.ethereum.org/2023/12/19/esp-allocation-q323","2023","Q3","8945982.74"
"Community & education","Solidity Course & Speed Run Ethereum Workshops","<a href=""https://linktr.ee/ethcobogota"" target=""_blank"">ETH Bogota</a>","<a href=""https://ethkipu.org/"" target=""_blank"">ETH Kipu</a>, <a href=""https://speedrunethereum.com/"" target=""_blank"">Speed Run Ethereum</a>","","https://blog.ethereum.org/2023/12/19/esp-allocation-q323","2023","Q3","8945982.74"
"Community & education","","<a href=""https://linktr.ee/PhoenixGuildHQ"" target=""_blank"">The Phoenix Guild</a>","Series of technical workshops in different cities across India, with the goal of increasing students' and developers' understanding of Ethereum.","","https://blog.ethereum.org/2023/12/19/esp-allocation-q323","2023","Q3","8945982.74"
"Community & education","<a href=""https://www.tum-blockchain.com/conference"" target=""_blank"">TUM Blockchain Conference</a>","<a href=""https://twitter.com/tbc_munich"" target=""_blank"">TUM Blockchain Club</a>","Student-run conference in Munich, Germany delving into topics such as account abstraction, zkEVM, and regulation.","","https://blog.ethereum.org/2023/12/19/esp-allocation-q323","2023","Q3","8945982.74"
"Community & education","Updating the Ethereum Yellow Paper","<a href=""https://twitter.com/alex_kroeger"" target=""_blank"">Alex Kroeger</a>","<a href=""https://github.com/ethereum/yellowpaper"" target=""_blank"">Ethereum Yellow Paper</a>","","https://blog.ethereum.org/2023/12/19/esp-allocation-q323","2023","Q3","8945982.74"
"Community & education","ZK Course in Mandarin Chinese","<a href=""https://github.com/Dapp-Learning-DAO/Dapp-Learning"" target=""_blank"">Dapp-Learning</a>","Free and open-source ZK course in Mandarin Chinese that covers cryptography basics, ECDSA multi-signatures, and proof systems.","","https://blog.ethereum.org/2023/12/19/esp-allocation-q323","2023","Q3","8945982.74"
"Community & education","","ZK & Math Community Belgrade","Support to run a cryptography course aiming to increase Serbian students' understanding of ZKPs, its applications, and how proving schemes work.","","https://blog.ethereum.org/2023/12/19/esp-allocation-q323","2023","Q3","8945982.74"
"Community & education","<a href=""https://zkproof.org/events/zkproof-5-5-barcelona/"" target=""_blank"">ZKProof 5.5</a>","","ZK event in Barcelona, Spain delving into topics such as PLONK standardization, ZKML, and recursive proof composition.","","https://blog.ethereum.org/2023/12/19/esp-allocation-q323","2023","Q3","8945982.74"
"Community & education","<a href=""https://www.zksummit.com/"" target=""_blank"">zkSummit 10</a>","","ZK event in London, the United Kingdom comprising talks and workshop about ZK research, cryptographic primitives, privacy and maths, and ZK use-cases.","","https://blog.ethereum.org/2023/12/19/esp-allocation-q323","2023","Q3","8945982.74"
"Community & education","<a href=""https://zkwarsaw.dev/day.html"" target=""_blank"">zkWarsaw Day</a>","","ZK-focused event in Warsaw, Poland covering topics such as ZKML, zkRollups, and formal verification.","","https://blog.ethereum.org/2023/12/19/esp-allocation-q323","2023","Q3","8945982.74"
"Community & education","<a href=""https://0xvillage.org/"" target=""_blank"">0xVillage</a>","","<a href=""https://nesinkoyleri.org/en/main-page/"" target=""_blank"">Nesin Mathematics Village</a>","","https://blog.ethereum.org/2023/12/19/esp-allocation-q323","2023","Q3","8945982.74"
"Consensus layer","Fork Choice Specification Compliance","<a href=""https://github.com/ericsson49"" target=""_blank"">Alex Vlasov</a>, <a href=""https://twitter.com/mkalinin2"" target=""_blank"">Mikhail Kalinin</a>","Ensure specification compliance of fork choice implementations by cooperating with client implementers to implement a seed corpus of test vectors and test mutation operators.","","https://blog.ethereum.org/2023/12/19/esp-allocation-q323","2023","Q3","8945982.74"
"Consensus layer","<a href=""https://lighthouse.sigmaprime.io/"" target=""_blank"">Lighthouse</a>","<a href=""https://sigmaprime.io/"" target=""_blank"">Sigma Prime</a>","Continued development of the Lighthouse consensus client.","","https://blog.ethereum.org/2023/12/19/esp-allocation-q323","2023","Q3","8945982.74"
"Consensus layer","P2P Research","<a href=""https://leiy.me/"" target=""_blank"">Lei Yang</a>","Implementation of a new rateless set reconciliation protocol library and performance tests on an adaptive BFT broadcast protocol in variable networks.","","https://blog.ethereum.org/2023/12/19/esp-allocation-q323","2023","Q3","8945982.74"
"Consensus layer","Smoothing Pools Research","<a href=""https://warpcast.com/kodys.eth"" target=""_blank"">Kody Sale</a>, <a href=""https://github.com/noahfigueras"" target=""_blank"">Noah Figueras</a>","Research on smoothing pools which enable solo stakers to pool their tips and MEV from block proposals together, thereby increasing their rewards and allowing for more frequent distributions.","","https://blog.ethereum.org/2023/12/19/esp-allocation-q323","2023","Q3","8945982.74"
"Cryptography & zero knowledge proofs","<a href=""https://eprint.iacr.org/2023/1384"" target=""_blank"">Acceleration of Multi-Scalar Multiplications</a>","<a href=""https://www.linkedin.com/in/dimitri-koshelev"" target=""_blank"">Dimitri Koshelev</a>","Research on accelerating multi-scalar multiplications, which can increase the efficiency of elliptic curve cryptography and enhance the overall security and efficiency of blockchain systems.","<a href=""mailto:dimitri.koshelev@gmail.com"" target=""_blank"">Email</a>","https://blog.ethereum.org/2023/12/19/esp-allocation-q323","2023","Q3","8945982.74"
"Cryptography & zero knowledge proofs","<a href=""https://github.com/hcheng826/anon-exchange"" target=""_blank"">Anonymous Exchange</a>","<a href=""https://twitter.com/lilioo826"" target=""_blank"">Hung Cheng</a>","<a href=""https://semaphore.pse.dev/"" target=""_blank"">Semaphore</a>","<a href=""https://twitter.com/lilioo826"" target=""_blank"">Twitter</a>","https://blog.ethereum.org/2023/12/19/esp-allocation-q323","2023","Q3","8945982.74"
"Cryptography & zero knowledge proofs","<a href=""https://github.com/privacy-scaling-explorations/chiquito"" target=""_blank"">Chiquito</a>","<a href=""https://github.com/qwang98"" target=""_blank"">Steve Wang</a>","Chiquito is a step-based high-level Rust DSL (Pychiquito is a Python DSL for Chiquito) that provides better syntax and abstraction for constraint building and column placement when writing plonkish circuits and has a Halo2 backend, and other backends are in the works.","","https://blog.ethereum.org/2023/12/19/esp-allocation-q323","2023","Q3","8945982.74"
"Cryptography & zero knowledge proofs","CryptKeeper Verifiable Credential Integration","","<a href=""https://github.com/CryptKeeperZK/crypt-keeper-extension"" target=""_blank"">CryptKeeper</a>","","https://blog.ethereum.org/2023/12/19/esp-allocation-q323","2023","Q3","8945982.74"
"Cryptography & zero knowledge proofs","DID for Taiwan Citizen Digital Certificate","<a href=""https://github.com/yurenju"" target=""_blank"">yurenju</a>","<a href=""https://semaphore.pse.dev/"" target=""_blank"">Semaphore</a>","","https://blog.ethereum.org/2023/12/19/esp-allocation-q323","2023","Q3","8945982.74"
"Cryptography & zero knowledge proofs","<a href=""https://github.com/Discreetly"" target=""_blank"">Discreetly</a>","<a href=""https://github.com/codetrauma"" target=""_blank"">Tanner Shaw</a>","<a href=""https://rate-limiting-nullifier.github.io/rln-docs/"" target=""_blank"">Rate-Limiting Nullifier</a>, <a href=""https://semaphore.pse.dev/"" target=""_blank"">Semaphore</a>","","https://blog.ethereum.org/2023/12/19/esp-allocation-q323","2023","Q3","8945982.74"
"Cryptography & zero knowledge proofs","<a href=""https://github.com/zk-passport/embassy"" target=""_blank"">Embassy</a>","<a href=""https://github.com/0xturboblitz"" target=""_blank"">Florent Tavernier</a>, <a href=""https://github.com/yssf-io"" target=""_blank"">Youssef</a>","Proof of passport protocol that mints users a soulbound token after verification that they are a holder of a passport, which is completed on-chain in a ZK circuit.","<a href=""https://t.me/FlorentTavernier"" target=""_blank"">Telegram</a>","https://blog.ethereum.org/2023/12/19/esp-allocation-q323","2023","Q3","8945982.74"
"Cryptography & zero knowledge proofs","Front-End Development for PSE Projects","<a href=""https://www.linkedin.com/in/kalidou-diagne/"" target=""_blank"">Kalidou Diagne</a>","<a href=""https://pse.dev/"" target=""_blank"">PSE website</a>, <a href=""https://www.jubmoji.quest/"" target=""_blank"">jubmoji.quest</a>","","https://blog.ethereum.org/2023/12/19/esp-allocation-q323","2023","Q3","8945982.74"
"Cryptography & zero knowledge proofs","<a href=""https://github.com/oskarth/mopro"" target=""_blank"">mopro</a>","<a href=""https://oskarth.com/"" target=""_blank"">Oskar</a>","Project that makes client-side proving on mobile simple and enables developers to easily write circuits that can be run from a phone.","","https://blog.ethereum.org/2023/12/19/esp-allocation-q323","2023","Q3","8945982.74"
"Cryptography & zero knowledge proofs","<a href=""https://github.com/MynaWallet"" target=""_blank"">MynaWallet</a>","<a href=""https://a42x.co.jp/"" target=""_blank"">a42x</a>","Develop proof-of-concept privacy-protecting features using ZKPs for MynaWallet, which enables users to operate ERC-4337-compliant contract accounts using a personal identification card issued by the Japanese government.","<a href=""mailto:info@a42x.co.jp"" target=""_blank"">Email</a>","https://blog.ethereum.org/2023/12/19/esp-allocation-q323","2023","Q3","8945982.74"
"Cryptography & zero knowledge proofs","<a href=""https://pse.dev/"" target=""_blank"">PSE</a>","<a href=""https://www.linkedin.com/in/dominik-zast%C3%A1vka/?originalSubdomain=cz"" target=""_blank"">Dominik Zastávka</a>","<a href=""https://www.zuzalu.city/dashboard/eventview/about?event_space_id=873f2ae3-bcab-4a30-8b99-cb5e011a9db0"" target=""_blank"">ZuConnect</a>, <a href=""https://progcrypto.org/"" target=""_blank"">Progcrypto</a>","","https://blog.ethereum.org/2023/12/19/esp-allocation-q323","2023","Q3","8945982.74"
"Cryptography & zero knowledge proofs","<a href=""https://github.com/base0010/plume-ledger-app"" target=""_blank"">PLUME on Ledger App</a>","","PLUME plugin application that works on Ledger hardware wallet platforms.","","https://blog.ethereum.org/2023/12/19/esp-allocation-q323","2023","Q3","8945982.74"
